source_published_date,source_name,source_type,source_url,incident_description,incident_tags,incident_location,incident_location_type,incident_type,incident_action_type,incident_covid_related,victim_group_targeted,victim_gender,source_unavailable
"Nov 20, 2020",NextShark,Blog,https://web.archive.org/web/20210413221916/https://nextshark.com/memorial-sign-for-deputy-bruce-lee-is-vandalized-in-california/,"A road sign that commemorates a fallen Asian American deputy is defaced with the word ""worst"".",,"79900 CA-111, La Quinta, CA 92253, USA",Public area,Property-related,Graffiti,False,Asian,Unknown,False
"Nov 19, 2020",YouTube,Local news,https://web.archive.org/web/20210411031141/https://www.youtube.com/watch?v=MJaSQv0ivaA,"A bystander shouts, ""Tell his ass to go back to Korea"" at the scene of a car accident.",,"E 29th St & 1st Avenue, New York, NY 10016, USA",Public area,Harassment,"Verbal, gestural, or written harassment/threat",False,Korean,Male,False
"Nov 17, 2020",WCNC,Local news,https://web.archive.org/web/20210328043559/https://www.wcnc.com/article/news/crime/very-sick-feeling-inside-local-real-estate-agents-sign-spray-painted-with-ethnic-slur-aimed-at-people-of-chinese-descent/275-536509ec-63d4-4d08-b242-ed6f749b4abd,"""F_ck ch_nk"" is spray painted on an Asian American real estate broker's sign.",,"Lancaster Hwy, Charlotte, NC, USA",Public area,Property-related,Graffiti,False,Asian,Female,False
"Nov 17, 2020",FOX 5,Local news,https://web.archive.org/web/20210125230335/https://www.fox5dc.com/news/fairfax-montgomery-county-burglary-spree-ends-with-indictments,Four men target and burglarize more than 40 homes of families who tended to be of Asian or Middle Eastern descent.,,"Montgomery County, MD, USA",Home or housing,Property-related,Robbery or theft,false,Asian,Unknown,false
"Nov 13, 2020",Washington Post,National news,https://web.archive.org/web/20210125170211/https://www.washingtonpost.com/nation/2020/11/13/louisville-harassment-couple-swastikas-racial-slurs/,A security video shows the neighbor of an Asian couple spray painting a swastika on their driveway.,,"Lake Forest, Louisville, KY 40245, USA",Home or housing,Property-related,Graffiti,False,Asian,"Female, Male",False
"Nov 12, 2020",NBC News,National news,https://web.archive.org/web/20210212184814/https://www.nbcnews.com/news/asian-america/chinese-virus-sign-doctor-s-office-draws-rebuke-n1247418,"A sign at a chiropractor's office in New Jersey refers to the coronavirus as the ""Chinese virus.""",No individual target,"318 Sip Ave, Jersey City, NJ 07306, USA",Business,Harassment,Visual media or signage,true,Chinese,Unknown,False
"Nov 11, 2020",Creative Loafing Tampa,Local news,https://web.archive.org/web/20201112012920/https://www.cltampa.com/news-views/local-news/article/21146293/spring-hill-japanese-restaurant-receives-racist-phone-calls,A Japanese restaurant receives racist phone calls asking if they sell coronavirus and telling them to go back to their country.,,"14257 Powell Rd, Spring Hill, FL 34609, USA",Business,Harassment,"Verbal, gestural, or written harassment/threat",False,Asian,Unknown,False
"Nov 11, 2020",Washington Post,National news,https://web.archive.org/web/20210418000841/https://www.washingtonpost.com/politics/michigan--poll-watcher-affidavits/2020/11/11/4d073d7a-2447-11eb-a688-5298ad5d580a_story.html,"An individual tells a Chinese American woman ""you are not American"" while she is at a polling station.",,,Public area,Harassment,"Verbal, gestural, or written harassment/threat",False,Asian,Female,False
"Nov 10, 2020",ABC 7,Local news,https://web.archive.org/web/20201111024131/https://wjla.com/news/local/man-pepper-sprays-dc-restaurant-owner-in-anti-asian-attack-police-say,"A man enters a Chinese tea shop, makes comments about the coronavirus, and sprays the owner with pepper spray.",,"2101 P St NW, Washington, DC 20037, USA",Business,"Assault, Harassment","Assault with weapon, Verbal, gestural, or written harassment/threat",true,Chinese,Male,False
"Nov 9, 2020",NextShark,Blog,https://web.archive.org/web/20201128081211/https://nextshark.com/great-neck-trump-supporters-attack-asian-trump-supporters-with-racism-at-rally/,"A woman at a Trump rally shouts ""Take that sh_t back to China!"" at an Asian American family in a passing car.",Politics-related,"65 Arrandale Ave, Great Neck, NY 11024, USA",Public area,Harassment,"Verbal, gestural, or written harassment/threat",true,Chinese,Female,False
"Nov 5, 2020",Lowell Sun,Local news,https://web.archive.org/web/20210212085644/https://www.lowellsun.com/2020/11/05/racist-incidents-at-lowell-polls-probed/,"Police receive reports of people shouting phrases such as ""Go back to your country"" and ""Go back to where you come from"" at Asian Americans near polling stations.",,"Lowell High School, Lowell, MA 01852, USA",School,Harassment,"Verbal, gestural, or written harassment/threat",False,Asian,Unknown,False
"Nov 4, 2020",NextShark,Blog,https://web.archive.org/web/20201124120832/https://nextshark.com/anti-masker-rant-refused-service-thai-restaurant-nyc/,"A man calls an Asian woman ""foreign b_tch"" after an argument over his refusal to wear a mask indoors. ",Offender not wearing mask,"3602 36th Ave, Astoria, NY 11106, USA",Business,Harassment,"Verbal, gestural, or written harassment/threat",true,Asian,Female,false
"Nov 3, 2020",NBC 4,Local news,https://web.archive.org/web/20210404033831/https://www.nbclosangeles.com/news/california-news/la-jolla-family-says-they-were-racially-profiled-walking-to-the-beach/2454788/,"A woman on the street asks an Asian family, ""Why do Muslims behead white people and not Chinese people?""",,"Avenida De La Playa, San Diego, CA 92037, USA",Public area,Harassment,"Verbal, gestural, or written harassment/threat",False,Asian,"Female, Male",False
"Nov 3, 2020",Instagram,Social media,https://web.archive.org/web/20201104043442/https://www.instagram.com/tv/CHI_mFSJ9jN/?igshid=1i99uya0axeyz,"A man on the street shouts, ""Get the f_ck out of here Chinese!"" at an Asian American man outside a polling station. ",Politics-related,"Woodside, Queens, NY, USA",Public area,Harassment,"Verbal, gestural, or written harassment/threat",False,Chinese,Male,False
"Nov 2, 2020",Instagram,Social media,https://www.instagram.com/p/CHFX7BEBw1E/,"A woman shouts, “f_ck you Asian, go back to china where the virus came from. We don’t want you here anyway! F_ck you Asian Trump supporter! You are racist” at an Asian person. ",Politics-related,,Public area,Harassment,"Verbal, gestural, or written harassment/threat",true,Asian,Unknown,true
"Nov 2, 2020",FOX 40,Local news,https://web.archive.org/web/20210212172645/https://fox40.com/news/your-local-election-headquarters/yolo-county-da-investigates-voter-intimidation-incident-in-woodland/,"A voter registration cancellation form and a note reading, ""You voted in March. If you are not a citizen, you are not allowed to vote. Fill this out and return it to the elections office..."" are taped to the front door of an Asian American woman's home.",Politics-related,"Woodland, CA, USA",Home or housing,Harassment,"Verbal, gestural, or written harassment/threat",false,Asian,Female,false
"Nov 1, 2020",NPR,National news,https://web.archive.org/web/20210317201117/https://www.npr.org/2020/11/01/929960255/what-its-like-for-asian-american-candidates-during-a-pandemic-marked-by-racism,"A man says ""You're the one who brought the virus here. I hope you die"" to an Asian American woman passing out masks in front of a store.",,,Public area,Harassment,"Verbal, gestural, or written harassment/threat",False,Asian,Female,False
"Nov 1, 2020",Instagram,Social media,https://web.archive.org/web/20201102183953/https://www.instagram.com/p/CHDWj9DM_6m/?utm_source=ig_web_copy_link,A student pushes an Asian American student to the ground and hits her in the head.,No explicit bias,"815 N Broadway, Saratoga Springs, NY 12866, USA",College or university,Assault,Assault without weapon,False,Asian,Female,False
"Oct 31, 2020",Instagram,Social media,https://www.instagram.com/p/CG_0KMpA_PT/,"A man driving a van shouts ""Trump 2020"" and ""ch_nk"" at an Asian man on the highway.",Politics-related,"Los Angeles, CA, USA",Transportation,Harassment,"Verbal, gestural, or written harassment/threat",False,Asian,Male,False
"Oct 29, 2020",Instagram,Social media,https://www.instagram.com/p/CG8pYjcFPxR/,"An Asian American reporter experiences multiple instances of racial harassment at an airport. First, a man says ""Ni hao. Ching chong."" Another stranger asks if she speaks English and makes random sounds to mock the Chinese language.",,"Louis Armstrong New Orleans International Airport (MSY), 1 Terminal Dr, Kenner, LA 70062, USA",Transportation,Harassment,"Verbal, gestural, or written harassment/threat",False,Asian,Female,False
"Oct 27, 2020",Reddit,Social media,https://old.reddit.com/r/LeopardsAteMyFace/comments/jivlpf/vietnamese_trump_supporter_gets_harrassed_by/,A Trump supporter assaults and verbally assaults a Vietnamese Trump supporter. ,Politics-related,,Public area,"Harassment, Assault","Verbal, gestural, or written harassment/threat, Assault without weapon",False,Asian,Male,False
"Oct 26, 2020",Instagram,Social media,https://www.instagram.com/p/CGzSKWMhhvw/,"A man on the street shouts, ""Go to China and eat Chinese food. It's the Chinese food that created this,"" at a group of Asians at a rally. He also claims that California's state constitution bans Chinese people from employment.",,"Los Angeles, CA, USA",Public area,Harassment,"Verbal, gestural, or written harassment/threat",False,Chinese,Unknown,true
"Oct 25, 2020",Instagram,Social media,https://www.instagram.com/p/CGx68PPB9fW/,"A man on a bus harasses an Asian woman, calling her an ""Asian b_tch"" and blames the coronavirus on Asians. ",,"Queens, NY, USA",Transportation,Harassment,"Verbal, gestural, or written harassment/threat",true,Asian,Female,true
"Oct 24, 2020",Instagram,Social media,https://www.instagram.com/p/CGvM_eeg8zf/,"A man goes on a racist rant in a hallway, saying that Asians need to go back to their country and that he is happy that Asians are being attacked around the world.",No individual target,,Home or housing,Harassment,"Verbal, gestural, or written harassment/threat",False,Asian,Unknown,False
"Oct 22, 2020",AsAmNews,Blog,https://web.archive.org/web/20210301184837/https://asamnews.com/2020/10/22/neighbors-in-orange-county-attack-vietnamese-american-family-with-name-calling-profanity-xenophobic-insults/,"Neighbors repeatedly harass a Vietnamese American family, shouting ""f_ck your people,"" ""Asians are stupid,"" and ""go back home.""",,"Orange County, CA, USA",Home or housing,Harassment,"Verbal, gestural, or written harassment/threat",False,Asian,"Female, Male",False
"Oct 22, 2020",ABC 7,Local news,https://abc7news.com/sfpd-investigating-after-asian-woman-targeted-with-vandalism-racist-letter/7252610/?fbclid=IwAR14FEqEetl0McaC8X0a3jRWci-jFDvPGQId5YXS48hIpojJQ3amVsTF2rs,"After an Asian woman asks a fellow pedestrian to put on a mask, they begin to argue. A man throws objects at the woman's home and leaves a note reading ""keep America without Asians... I wear my mask if I want F_CKING ASIAN you create the virus"" on her doorstep. ","Target wearing mask, Offender not wearing mask","Sunset District, San Francisco, CA, USA",Home or housing,"Harassment, Property-related","Verbal, gestural, or written harassment/threat, Vandalism, damage, disorder, or destruction of property",true,Asian,Female,False
"Oct 21, 2020",Instagram,Social media,https://www.instagram.com/p/CGoDv66nmn5/?utm_source=ig_embed,"A man punches and kicks a Korean man in a parking garage and shouts ""stupid Asian"" before driving away.",,"6940 Beach Blvd, Buena Park, CA 90621, USA",Public area,Assault,"Assault without weapon, Verbal, gestural, or written harassment/threat",False,Asian,Male,False
"Oct 21, 2020",Instagram,Social media,https://www.instagram.com/p/CGndSu9BZ2n/,An individual assaults an Asian woman after she asks a customer to put on a mask. ,"Target wearing mask, No explicit bias, Unhoused offender, Offender not wearing mask",,Business,Assault,Assault without weapon,False,Asian,Female,true
"Oct 19, 2020",Instagram,Social media,https://www.instagram.com/p/CGg1DIYgOD5/,A man on the street harasses and pushes an Asian tourist outside Golden Gate Fortune Cookie Factory.,,"56 Ross Alley, San Francisco, CA 94108, USA",Public area,"Harassment, Assault","Verbal, gestural, or written harassment/threat, Assault without weapon",False,Asian,Male,False
"Oct 19, 2020",YouTube,Social media,https://web.archive.org/web/20201101201304/https://www.youtube.com/watch?v=kFIG3sxd5VA&feature=youtu.be,A man turns his car alarm on and follows an Asian man wearing a mask down the street. ,Target wearing mask,,Public area,Harassment,"Verbal, gestural, or written harassment/threat",False,Asian,Male,False
"Oct 17, 2020",Patch,Blog,https://web.archive.org/web/20201021004441/https://patch.com/illinois/northbrook/chinese-americans-plan-protest-coronavirus-sign-northbrook,"The word ""China"" is spray-painted on a ""COVID Death Scoreboard"" sign at Triangle Park in Northbrook.",No individual target,"Northbrook, IL 60062, USA",Public area,Property-related,Graffiti,False,Chinese,Unknown,False
"Oct 15, 2020",San Angelo LIVE!,Local news,https://web.archive.org/web/20201026213158/https://www.sanangelolive.com/news/crime/2020-10-15/couple-arrested-trying-burn-down-chinese-restaurant,A couple attempts to burn down a Chinese restaurant.,"No explicit bias, Restaurant","3744 Andrews Hwy, Odessa, TX 79762, USA",Business,Property-related,"Vandalism, damage, disorder, or destruction of property",False,Chinese,Unknown,False
"Oct 13, 2020",Instagram,Local news,https://www.instagram.com/tv/CGTxsj4p3S6/?utm_source=ig_embed,"A man calls a Korean American reporter ""ch_nky"" while he is filming a segment on the street.",,"Brooklyn, NY, USA",Public area,Harassment,"Verbal, gestural, or written harassment/threat",False,Asian,Male,False
"Oct 12, 2020",Instagram,Social media,https://www.instagram.com/p/CGRDDjHlFhs/,A woman at a park tells an Asian woman and her son that they brought the coronavirus to New York.,,"FDR Dr, New York, NY 10021, USA",Public area,Harassment,"Verbal, gestural, or written harassment/threat",true,Asian,Female,False
"Oct 10, 2020",CBS 2,Local news,https://web.archive.org/web/20210417235556/https://newyork.cbslocal.com/2020/10/10/japanese-jazz-pianist-tadataka-unno-badly-injured-after-attack-in-subway/,Eight people assault Japanese jazz pianist Tadataka Unno at a subway station near his home.,,"W 135th St & St Nicholas Terrace, New York, NY 10031, USA",Public area,Assault,Assault without weapon,False,Asian,Male,False
"Oct 9, 2020",New York Post,Local news,https://web.archive.org/web/20210106185847/https://nypost.com/2020/10/09/police-hunting-for-suspect-in-anti-asian-attack-in-nyc/,An individual shouts anti-Asian slurs at a 40-year-old Asian man getting out of his car then punches and chokes him.,,"W 16th St & 7th Ave, New York, NY 10011, USA",Public area,"Assault, Harassment","Assault without weapon, Verbal, gestural, or written harassment/threat",False,Asian,Male,False
"Oct 9, 2020",ABC 7,Local news,https://web.archive.org/web/20210321032049/https://abc7news.com/society/fremont-woman-tells-neighbor-10-year-old-girl-to-go-back-to-china/6901188/,"An individual verbally harasses an Asian woman and her 10-year-old daughter in their neighborhood; the perpetrator shouts ""Go back to China"" at them. ",,"Fremont, CA, USA",Public area,Harassment,"Verbal, gestural, or written harassment/threat",False,Asian,Female,False
"Oct 8, 2020",Instagram,Social media,https://www.instagram.com/p/CGF1gqIhumS/,A man destroys a hydrangea plant in front of a Buddhist Church's main entrance.,"No individual target, No explicit bias","332 Riverside Dr, New York, NY 10025, USA",Place of worship,Property-related,"Vandalism, damage, disorder, or destruction of property",False,Asian,Unknown,true
"Oct 6, 2020",AsAmNews,Blog,https://web.archive.org/web/20210115062325/https://asamnews.com/2020/10/06/professor-deflects-what-he-says-was-an-unprovoked-punch-from-a-large-woman-he-believes-the-attack-was-racially-motivated-in-the-current-anti-asian-climate-worsened-by-the-pandemic/,"A woman on the street shouts, ""I have to do this!"" and attempts to punch an Asian man in the face.",No explicit bias,"4224 NE Halsey St, Portland, OR 97213, USA",Public area,Assault,Assault without weapon,False,Asian,Male,False
"Oct 5, 2020",Instagram,Social media,https://www.instagram.com/p/CF-zeq3B3FK,"An individual without a mask approaches an 86-year-old Asian American war veteran. When the veteran asks the man to put a mask on, he responds, ""Why should I have to? You guys brought this virus over here in the first place."" ","Target wearing mask, Elderly target, Offender not wearing mask","8230 Talbert Ave, Huntington Beach, CA 92646, USA",Public area,Harassment,"Verbal, gestural, or written harassment/threat",true,Asian,Male,true
"Oct 4, 2020",Instagram,Social media,https://www.instagram.com/p/CF7yJIIB04p/,"A man shouts,  ""Ching chong, f_cking ch_nks"" at two Asian Americans in a store parking lot.",,,Public area,Harassment,"Verbal, gestural, or written harassment/threat",False,Asian,Female,False
"Oct 3, 2020",Instagram,Social media,https://web.archive.org/web/20201116125346/https://www.instagram.com/p/CF5XzAejAQb/,An individual assaults an elderly Vietnamese woman outside her home and knocks her unconscious. ,"No explicit bias, Elderly target","San Francisco, CA, USA",Home or housing,Assault,Assault without weapon,False,Asian,Female,False
"Oct 3, 2020",Facebook,Social media,https://www.facebook.com/timothy.khanchaleun/posts/3578607142158981,"An elderly man harasses two Asian American men, calling one a ""Chinese communist"" after seeing them wearing masks.",Target wearing mask,,Public area,Harassment,"Verbal, gestural, or written harassment/threat",False,Chinese,Male,False
"Oct 1, 2020",CBS Minnesota,Local news,https://web.archive.org/web/20210428012355/https://minnesota.cbslocal.com/2020/10/01/trump-supporter-attacks-wcco-photojournalist-in-duluth-you-want-to-be-violent-come-to-me/,An elderly man assaults an Asian photo journalist at a Trump rally.,"No explicit bias, Politics-related","Duluth, MN, USA",Public area,Assault,Assault without weapon,False,Asian,Male,False
"Sep 29, 2020",Instagram,Social media,https://www.instagram.com/p/CFvm_4ODI8Q/,"A man shouts, ""the plague came from Wuhan"" at Asian American protesters on the street.",No individual target,,Public area,Harassment,"Verbal, gestural, or written harassment/threat",False,Chinese,"Female, Male",False
"Sep 27, 2020",NBC 4,Local news,https://web.archive.org/web/20210114080527/https://www.nbcnewyork.com/news/local/nypd-5-suspects-steal-wallet-break-nose-of-59-year-old-in-queens-attack/2638828/,Five men assault and rob a 59-year-old Asian man on the street. ,"No explicit bias, Elderly target","Murray Hill, Queens, NY, USA",Public area,"Assault, Property-related","Assault without weapon, Robbery or theft",False,Asian,Male,False
"Sep 24, 2020",NBC News,National news,https://web.archive.org/web/20210404033814/https://www.nbcnews.com/news/us-news/man-who-allegedly-told-korean-american-entrepreneur-go-back-wuhan-n1240937,"A man tells two Asian American women to ""go back to Wuhan"" at a restaurant.",,"630 Lido Park Dr, Newport Beach, CA 92663, USA",Business,Harassment,"Verbal, gestural, or written harassment/threat",False,Chinese,Female,False
"Sep 24, 2020",FOX40,Local news,https://web.archive.org/web/20210331223709/https://fox40.com/news/local-news/masked-attacker-grabs-elk-grove-woman-her-3-year-old-daughter-outside-their-apartment-complex/,A masked individual assaults an Asian woman and her 3-year-old daughter in the parking lot of their apartment complex. ,No explicit bias,"Center Pkwy & Bruceville Rd, Elk Grove, CA 95758, USA",Public area,Assault,Assault without weapon,False,Asian,Female,False
"Sep 23, 2020",Hawaii News Now,Local news,https://web.archive.org/web/20201020064408/https://www.hawaiinewsnow.com/2020/09/24/police-search-suspect-who-targeted-elderly-victim-chinatown-attack/,A man assaults and robs an elderly Asian woman in Chinatown. ,"No explicit bias, Elderly target","100 N Beretania St, Honolulu, HI 96817, USA",Public area,"Assault, Property-related","Assault without weapon, Robbery or theft",False,Asian,Female,False
"Sep 22, 2020",World Journal,National news,https://web.archive.org/web/20200925185618/https://www.worldjournal.com/wj/story/121360/4878718?from=wj_hot_story,"After refusing to put on masks in a convenience store, a man and woman shout at an Asian woman, ""Your skin is so yellow. You don't belong here, you shouldn't live here [translation]."" The man then proceeds to punch the victim while attempting to take her phone.",Offender not wearing mask,,Business,"Assault, Harassment, Property-related","Assault without weapon, Verbal, gestural, or written harassment/threat, Robbery or theft",False,Asian,Female,False
"Sep 18, 2020",ABC 7,Local news,https://web.archive.org/web/20201008192539/https://wjla.com/news/local/teen-charged-with-murder-in-stabbing-of-laundromat-employee-in-capitol-heights,A teen stabs a Chinese employee of a laundromat to death.,"No explicit bias, Minor-age offender","6700 Walker Mill Rd, Capitol Heights, MD 20743, USA",Business,Assault,Assault with weapon,False,Asian,Male,False
"Sep 17, 2020",ABC 6,Local news,https://web.archive.org/web/20210404033828/https://www.kaaltv.com/austin-minnesota-news/austin-chinese-burned-front-yard/5866215/,"An Asian man finds the words ""China virus"" burned into the front yard of his home.",,"Austin, MN 55912, USA",Home or housing,Harassment,"Verbal, gestural, or written harassment/threat, Vandalism, damage, disorder, or destruction of property",False,Asian,Male,False
"Sep 15, 2020",San Francisco Examiner,Local news,https://web.archive.org/web/20210126091831/https://www.sfexaminer.com/news/suspected-arsonist-caught-on-video-at-sunset-district-store/,A man sets a Chinese printing store on fire; the store is owned by a family from Hong Kong.,"No explicit bias, No individual target","450 Taraval St, San Francisco, CA 94116, USA",Business,Property-related,"Vandalism, damage, disorder, or destruction of property",False,Chinese,Unknown,False
"Sep 15, 2020",CBS SF BayArea,Local news,https://web.archive.org/web/20210328053721/https://sanfrancisco.cbslocal.com/2020/09/15/man-armed-with-blowtorch-wd-40-axe-knife-sets-customers-hair-on-fire-at-berkeley-boba-tea-shop/,A man sets an Asian man's hair on fire at a bubble tea restaurant using DW-40 and a blowtorch.,No explicit bias,"2528A Durant Ave, Berkeley, CA 94704, USA",Business,Assault,Assault with weapon,False,Asian,Male,False
"Sep 15, 2020",AsAmNews,Blog,https://web.archive.org/web/20210114175841/https://asamnews.com/2020/09/15/graffiti-vandals-scrawl-the-word-spy-across-the-door-of-two-international-international-students-at-rice-university/,"""Spy"" is written on the dorm room door of a university student from China.",,"6100 Main St, Houston, TX 77005, USA",College or university,Property-related,Graffiti,False,Asian,Female,False
"Sep 14, 2020",Hawaii News Now,Local news,https://web.archive.org/web/20210126224905/https://www.hawaiinewsnow.com/2020/09/15/family-seeking-help-after-someone-vandalized-several-graves-waianae-japanese-cemetery/,Several graves at the Waianae Japanese Cemetery are vandalized.,,"85-235 Waianae Valley Rd, Waianae, HI 96792, USA",Place of worship,Property-related,"Vandalism, damage, disorder, or destruction of property",False,Japanese,Unknown,False
"Sep 14, 2020",City Pages,Local news,http://44.228.233.147/news/racist-yelling-about-covid-attacks-woman-in-bloomington/572407081,"A man shouts ""you don’t belong here"" and comments about the coronavirus at an Asian American hiker before hitting her with a tree branch.",,"3815 American Blvd E, Bloomington, MN 55425, USA",Public area,"Harassment, Assault","Verbal, gestural, or written harassment/threat, Assault with weapon",False,Asian,Female,true
"Sep 10, 2020",Newsweek,National news,https://web.archive.org/web/20210215115730/https://www.newsweek.com/ny-police-probe-allegedly-racist-t-shirts-left-outside-black-asian-homes-1531173,"T-shirts bearing the following message are left outside an Asian American family's home: ""You came here from there be­cause you did­n't like there, and now you want to change here to be like there. We are not racist, pho­bic, or anti what­ever-you-are, we sim­ply like here the way it is and many of us were ac­tu­ally born here and stayed be­cause it is not like there, wher­ever there was.""",,"Dobbs Ferry, NY, USA",Home or housing,Harassment,"Verbal, gestural, or written harassment/threat",False,Asian,Unknown,False
"Sep 8, 2020",CBS Los Angeles,Local news,https://web.archive.org/web/20200924014412/https://losangeles.cbslocal.com/2020/09/08/racist-rant-caught-on-camera-in-garden-grove/,"An elderly woman enters her Asian neighbor's garage and shouts ""I don’t think you live here because… you have slanted eyes"".",,"Garden Grove, CA, USA",Home or housing,Harassment,"Verbal, gestural, or written harassment/threat",False,Asian,Male,False
"Sep 7, 2020",Facebook,Social media,https://www.facebook.com/AznDawn/videos/vb.108067297470307/311107016844668/?type=2&theater,"A man calls an Asian American policeman a ""monkey"" and tells him to ""get out of my country.""",,,Public area,Harassment,"Verbal, gestural, or written harassment/threat",False,Asian,Male,False
