source_published_date,source_name,source_type,source_url,incident_description,incident_tags,incident_location,incident_location_type,incident_type,incident_action_type,incident_covid_related,victim_group_targeted,victim_gender,source_unavailable
"Jun 7, 2021",NBC News,National news,https://web.archive.org/web/20210612032438/https://www.nbcnews.com/news/us-news/woman-shot-nail-salon-owner-because-she-was-unhappy-cost-n1269871,A woman shoots a 42-year-old Asian nail salon owner after arguing over the price of services.  ,No explicit bias,"21949 Katy Fwy c, Katy, TX 77450, USA",Business,Assault,Assault with weapon,false,Asian,Male,false
"Jun 7, 2021",WMAR 2,Local news,https://web.archive.org/web/20210607202522/https://www.wmar2news.com/news/local-news/baltimore-man-accused-of-hate-filled-rampage-against-multiple-asian-american-business-owners,A man harasses and assaults multiple Asian American business owners and vandalizes their stores. ,"Elderly target, Offender not wearing mask","900 W North Ave, Baltimore, MD 21217, USA",Business,"Assault, Property-related, Harassment","Assault with weapon, Vandalism, damage, disorder, or destruction of property, Verbal, gestural, or written harassment/threat",false,Chinese,"Female, Male",false
"Jun 6, 2021",Chicago Sun Times,Local news,https://chicago.suntimes.com/news/2021/6/6/22518897/yiran-fan-university-chicago-doctoral-student-killed-dissertation-defended-professors,An individual shoots an Asian doctoral student in a parking garage. ,No explicit bias,"S East End Ave, Chicago, IL 60615, USA",Public area,Assault,Assault with weapon,false,Asian,Male,false
"Jun 4, 2021",ABC 6,Local news,https://web.archive.org/web/20210629030835/https://6abc.com/philadelphia-attack-father-killed-wei-lin-juniata-accident/10740375/,A man punches a 28-year-old Asian man in the head in an unprovoked attack; the victim dies from his injuries three days later. ,No explicit bias,"L St & E Luzerne St, Philadelphia, PA 19124, USA",Public area,Assault,Assault without weapon,false,Asian,Male,false
"Jun 4, 2021",Newsweek,National news,https://web.archive.org/web/20210721054309/https://www.newsweek.com/chicago-woman-told-go-back-asia-confrontation-face-mask-1597505,"A man verbally harasses a 34-year-old Chinese woman for wearing a mask while she is walking with her infant son; the perpetrator also tells the victim to ""go back to Asia.""",Target wearing mask,"Little Italy, Chicago, IL, USA",Public area,Harassment,"Verbal, gestural, or written harassment/threat",false,Asian,Female,false
"Jun 4, 2021",Hopclear,Blog,https://web.archive.org/web/20210618085558/https://www.hopclear.com/asian-ups-delivery-driver-attacked-and-almost-robbed-of-his-package-in-san-francisco/,An individual assaults a Vietnamese American UPS delivery driver while attempting to rob him. ,No explicit bias,"Gough St & Haight St, San Francisco, CA 94102, USA",Public area,"Assault, Property-related","Assault without weapon, Robbery or theft",false,Asian,Male,false
"Jun 2, 2021",New York Post,Local news,https://web.archive.org/web/20210616201204/https://nypost.com/2021/06/01/criminal-with-dozens-of-priors-busted-in-nyc-subway-attack-again/,A man kicks a 65-year-old Asian woman down the stairs at a train station. ,"No explicit bias, Elderly target","W 34th St, New York, NY, USA",Transportation,Assault,Assault without weapon,false,Asian,Female,false
"Jun 1, 2021",HuffPost,Blog,https://web.archive.org/web/20210623005707/https://www.huffpost.com/entry/asian-woman-attacked-nyc_n_60b5ae91e4b0ead2796c3c53,A man approaches a 55-year-old Asian woman and punches her in the face in an unprovoked attack. ,"Elderly target, No explicit bias","Bayard St, New York, NY, USA",Public area,Assault,Assault without weapon,false,Asian,Female,false
"Jun 1, 2021",ABC 7,Local news,https://web.archive.org/web/20210617045318/https://abc7news.com/exclusive-older-asian-woman-robbed-while-moving-in-oakland/10729888/,A woman robs an 89-year-old Asian woman of her belongings while she is moving; an elderly neighbor attempts to intervene and is assaulted by the perpetrator.,"No explicit bias, Elderly target, Third party intervenes ","Oakland, CA, USA",Public area,Property-related,Robbery or theft,false,Asian,Female,false
"Jun 1, 2021",NBC New York,Local news,https://web.archive.org/web/20210610054254/https://www.nbcnewyork.com/news/local/two-sikh-teens-say-they-were-targeted-for-religion-at-long-island-mall/3083304/,A group of teens verbally harass two Sikh teens over their religion; one of the perpetrators punches one of the victims in the face.,Minor-age offender,"Walt Whitman Shops, South Huntington, NY 11746, USA",Business,"Assault, Harassment","Assault without weapon, Verbal, gestural, or written harassment/threat",false,Asian,Male,false
"Jun 1, 2021",Fox 25,Local news,https://web.archive.org/web/20210602170111/https://okcfox.com/news/local/thai-restaurant-vandalized-four-times-owner-believes-they-were-the-target-of-asian-hate,A family-owned Thai restaurant is vandalized four times in less than two months.,"No explicit bias, Restaurant","5501 Main St, Oklahoma City, OK 73115, USA",Business,Property-related,"Vandalism, damage, disorder, or destruction of property",false,Asian,Female,false
"Jun 1, 2021",University of Hawai'i News,Local news,https://web.archive.org/web/20210603021217/https://www.hawaii.edu/news/2021/06/01/asian-studies-degree/,"An individual calls an Asian student a ""J_p wh_re"" and a ‘ch_nk’ while telling her to ""go back to her country"" and threatening to physically harm her.",,"Portland, OR, USA",Transportation,Harassment,"Verbal, gestural, or written harassment/threat",false,"Chinese, Japanese",Female,false
"May 31, 2021",ABC 7,Local news,https://web.archive.org/web/20210626100301/https://abc7news.com/exclusive-witness-describes-violent-attack-on-asian-sfpd-officer/10720390/,A man makes threats to Asian individuals on the street before an Asian police officer confronts him; the perpetrator then assaults the officer and is later apprehended with the help of bystanders and other police officers. ,"Third party intervenes , Unhoused offender","Kearny St & Commercial St, San Francisco, CA 94108, USA",Public area,"Assault, Harassment","Verbal, gestural, or written harassment/threat, Assault without weapon",false,Asian,"Female, Unknown",false
"May 29, 2021",New York Post,Local news,https://web.archive.org/web/20210529200855/https://nypost.com/2021/05/29/nyc-panhandler-threatened-to-kill-asian-man-in-alleged-hate-crime/,"A man threatens to kill a 24-year-old Asian man before attempting to steal his phone and bag; the perpetrator asks ""You are Chinese, aren't you?"" during the incident. ",,"W 34th St & 6th Ave, New York, NY 10001, USA",Transportation,"Assault, Harassment, Property-related","Assault without weapon, Robbery or theft, Verbal, gestural, or written harassment/threat",false,Chinese,Male,false
"May 29, 2021",The Bellingham Herald,Local news,https://www.bellinghamherald.com/news/local/crime/article251731378.html,"A man assaults an Asian healthcare worker and mentions his ""dislike of Asian people"" to a second worker who witnesses the attack. ",Third party intervenes ,"2901 Squalicum Pkwy, Bellingham, WA 98225, USA",Hospital or clinic,"Assault, Harassment","Assault without weapon, Verbal, gestural, or written harassment/threat",false,Asian,Unknown,false
"May 28, 2021",Asian Dawn,Blog,https://web.archive.org/web/20210604022513/https://www.asian-dawn.com/2021/05/28/asian-grandmother-attacked-and-robbed-in-boston/,An individual assaults and robs an elderly Asian woman outside her apartment; bystanders chase away the perpetrator and call the police.,"Third party intervenes , Elderly target, No explicit bias","Washington St & Northampton St, Boston, MA 02118, USA",Public area,"Assault, Property-related","Assault without weapon, Robbery or theft",false,Asian,Female,false
"May 28, 2021",Greater Greater Washington,Local news,https://web.archive.org/web/20210604182103/https://ggwash.org/view/81490/on-being-asian-american-in-public-spaces-and-everywhere-else,"A man driving in his car tells an Asian mother and daughter ""You need to control your daughter. Why is she biking in the street?” Before the victim could respond, he then adds “This is the problem with Asians! You are the problem!”",,"Fessenden St NW, Washington, DC, USA",Public area,Harassment,"Verbal, gestural, or written harassment/threat",false,Asian,Female,false
"May 27, 2021",Hopclear,Blog,https://web.archive.org/web/20210527203548/https://www.hopclear.com/sikh-man-killed-in-san-jose-mass-shooting/,"A gunman goes on a rampage and kills 9 people, one of whom is a Sikh man.","No explicit bias, No individual target","101 W Younger Ave, San Jose, CA 95110, USA",Public area,Assault,Assault with weapon,false,Asian,Male,false
"May 27, 2021",NBC New York,Local news,https://web.archive.org/web/20210601123755/https://www.nbcnewyork.com/news/local/75-year-old-asian-woman-suffers-facial-fracture-in-unprovoked-nyc-attack/3078716/,An individual punches a 75-year-old Asian woman in the face in an unprovoked attack. ,"Elderly target, No explicit bias","57th Ave & 97th Pl, Queens, NY 11368, USA",Unknown,Assault,Assault without weapon,false,Asian,Female,false
"May 27, 2021",Facebook,Social media,https://fb.watch/5LM-4KVADi/,A group of teens attacks a Dim Sum restaurant. ,"Minor-age offender, No explicit bias","Manhattan, New York, NY, USA",Business,Property-related,"Vandalism, damage, disorder, or destruction of property",false,Asian,Unknown,false
"May 27, 2021",CBS SF BayArea,Local news,https://web.archive.org/web/20210628002417/https://sanfrancisco.cbslocal.com/2021/05/27/suspects-in-separate-robberies-of-elderly-asian-victims-arrested-in-san-francisco/,A man assaults and attempts to rob a 68-year-old Asian man at a bus stop. ,"No explicit bias, Elderly target","Geary Blvd & Fillmore St, San Francisco, CA 94115, USA",Transportation,"Assault, Property-related","Assault with weapon, Robbery or theft",false,Asian,Male,false
"May 27, 2021",CBS SF BayArea,Local news,https://web.archive.org/web/20210628002417/https://sanfrancisco.cbslocal.com/2021/05/27/suspects-in-separate-robberies-of-elderly-asian-victims-arrested-in-san-francisco/,A man approaches an 83-year-old Asian woman from behind and attempts to snatch her purse; the victim resists and a bystander runs over to help her. ,"Elderly target, No explicit bias, Third party intervenes ","Hickory St & Gough St, San Francisco, CA 94102, USA",Public area,"Assault, Property-related","Assault without weapon, Robbery or theft",false,Asian,Female,false
"May 27, 2021",CBS SF BayArea,Local news,https://web.archive.org/web/20210628002417/https://sanfrancisco.cbslocal.com/2021/05/27/suspects-in-separate-robberies-of-elderly-asian-victims-arrested-in-san-francisco/,A man assaults and robs a 65-year-old Asian woman; a bystander chases the perpetrator and nearby police officers apprehend the suspect. ,"Third party intervenes , Elderly target, No explicit bias","Sansome St & Sutter St, San Francisco, CA 94104, USA",Public area,"Assault, Property-related","Assault without weapon, Robbery or theft",false,Asian,Female,false
"May 27, 2021",CBS SF BayArea,Local news,https://web.archive.org/web/20210703013822/https://sanfrancisco.cbslocal.com/2021/05/27/assault-2-asian-american-sf-general-hospital-staffers-investigated-hate-crime/,An individual assaults two Asian American hospital staffers; the incident is being investigated as a hate crime.,,"1001 Potrero Ave, San Francisco, CA 94110, USA",Hospital or clinic,Assault,Unknown,false,Asian,Unknown,false
"May 27, 2021",WRAL,Local news,https://web.archive.org/web/20210531070012/https://www.wral.com/customers-rally-support-after-cary-bakery-other-south-hills-businesses-vandalized/19699044/,"A man enters a donut shop, grabs a donut, and throws it in the owner's face. When she chases him out, he grabs a trash can and smashes three windows of the shop.","No explicit bias, Restaurant","1307 Buck Jones Rd, Raleigh, NC 27606",Business,"Assault, Property-related","Assault with weapon, Vandalism, damage, disorder, or destruction of property",false,,Unknown,false
"May 26, 2021",New York Post,Local news,https://web.archive.org/web/20210617064510/https://nypost.com/2021/05/26/asian-cashier-punched-in-face-in-midtown-manhattan/,A man punches an Asian food market worker in the face after being asked to leave for not wearing a mask.,"Offender not wearing mask, No explicit bias","12 E 41st St, New York, NY 10017, USA",Business,Assault,Assault without weapon,false,Asian,Female,false
"May 26, 2021",Reddit,Social media,https://web.archive.org/web/20210526230257/https://www.reddit.com/r/PublicFreakout/comments/nlkdfh/racist_neighbor_comes_over_multiple_times_to_yell/,"A woman comes over multiple times to yell at an Asian family about their cars bothering her. She tries to push an Asian man who answers her at the door and tells him ""Shut the f_ck up, you Chinese f_ck. Go back to your f_cking country.""",,,Unknown,"Assault, Harassment","Assault without weapon, Verbal, gestural, or written harassment/threat",false,Chinese,Male,false
"May 25, 2021",Newsweek,National news,https://web.archive.org/web/20210708145310/https://www.newsweek.com/andrew-yang-slams-racist-daily-news-cartoon-asians-are-being-beaten-street-1594831,"The Daily News publishes a cartoon depicting Andrew Yang as a tourist, and Yang and his wife respond by calling the cartoon racist.","Politics-related, Public figure","New York, NY, USA","Online, Business",Harassment,Visual media or signage,false,Asian,Male,false
"May 25, 2021",Yahoo News,National news,https://web.archive.org/web/20210526071456/https://news.yahoo.com/racist-slurs-broken-glass-then-230654379.html,A man vandalizes an Asian-owned convenience store and verbally harasses the Korean owners. The same store was vandalized less than two months prior by another perpetrator who yelled anti-Asian comments during the incident. ,Elderly target,,Business,"Property-related, Harassment","Vandalism, damage, disorder, or destruction of property, Verbal, gestural, or written harassment/threat",false,Chinese,"Female, Male",false
"May 24, 2021",New York Post,Local news,https://web.archive.org/web/20210524195436/https://nypost.com/2021/05/24/asian-man-pushed-onto-subway-tracks-at-queensbridge-station/,A man pushes an Asian man onto the subway tracks in front of an oncoming train; the train goes into emergency mode and does not hit the victim. ,No explicit bias,"21st St & 41st Ave, Queens, NY 11101, USA",Transportation,Assault,Assault without weapon,false,Asian,Male,false
"May 24, 2021",Hopclear,Blog,https://web.archive.org/web/20210524191003/https://www.hopclear.com/asian-american-woman-shot-four-times-in-alhambra-california/,A man knocks on a door and asks for an Asian woman at the home then shoots the victim several times when she comes to the door.,No explicit bias,"1600 Benito Ave, Alhambra, CA 91803, USA",Home or housing,Assault,Assault with weapon,false,Asian,Female,false
"May 24, 2021",ABC 7,Local news,https://web.archive.org/web/20210702211925/https://abc7news.com/exclusive-71-year-old-describes-brutal-attack-in-oakland/10689513/,A woman gets out of a car and assaults a 71-year-old Asian man while attempting to rob him. ,"No explicit bias, Elderly target","Grand Lake, Oakland, CA, USA",Public area,"Assault, Property-related","Assault without weapon, Robbery or theft",false,Asian,Male,false
"May 24, 2021",Twitter,Social media,https://web.archive.org/web/20210526083830/https://twitter.com/dionlimtv/status/1396983941869957120,An Asian Latino man is bitten by a woman and dragged face down on the pavement for his jade necklace. ,"Elderly target, No explicit bias","Mandana Blvd & Grand Ave, Oakland, CA 94610, USA",Public area,Assault,"Assault without weapon, Robbery or theft",false,Asian,Male,false
"May 22, 2021",ESPN,National news,https://web.archive.org/web/20210702155914/https://www.espn.com/nfl/story/_/id/31490565/eugene-chung-says-was-called-not-right-minority-nfl-coaching-interview,"An unnamed individual tells former NFL offensive lineman and assist coach Eugene Chung, who is Korean, that he is ""not the right minority"" while interviewing for an NFL coaching job this offseason. ",,,Business,Shunning,"Unequal service, treatment, or opportunities",false,Asian,Male,false
"May 22, 2021",South China Morning Post,National news,https://www.scmp.com/sport/hong-kong/article/3134492/former-hong-kong-rugby-player-and-powerlifter-daniella-means-left,"A man hits an Asian woman in the head with a hammer while she is walking her dog, then takes her bag and phone before apologizing and running away. Bystanders help the victim after the attack and call the police. ","No explicit bias, Third party intervenes ","Los Angeles, CA, USA",Public area,"Assault, Property-related","Assault with weapon, Robbery or theft",false,Asian,Female,false
"May 21, 2021",NBC Bay Area,Local news,https://web.archive.org/web/20210603230007/https://www.nbcbayarea.com/news/local/man-who-attacked-elderly-woman-in-sf-nabbed-by-good-samaritans-police/2551630/,A man assaults and attempts to rob an Asian woman who is in her 80s. Two bystanders intervene to stop the attack and detain the perpetrator until the police arrive. ,"Third party intervenes , No explicit bias, Elderly target","Hickory St & Gough St, San Francisco, CA 94102, USA",Public area,"Assault, Property-related","Robbery or theft, Assault without weapon",false,Asian,Female,false
"May 21, 2021",KING 5,Local news,https://web.archive.org/web/20210522010121/https://www.king5.com/article/news/local/tacoma/tacoma-director-of-health-dr-anthony-chen-attacked-wednesday/281-025014a5-4b9f-46b1-867c-264295f95aab,"An Asian doctor walking his dog speaks to a man doing bicycle tricks on benches, expressing concern that the man is damaging the benches. When the doctor is walking away, the man knocks him down from behind and punches him as he stands up. ",No explicit bias,"Chihuly Bridge of Glass, Bridge of Glass, Tacoma, WA 98402, USA",Public area,Assault,Assault without weapon,false,Asian,Male,false
"May 21, 2021",NPR,National news,https://web.archive.org/web/20210721180719/https://www.npr.org/2021/05/21/999058293/whats-more-punk-than-teens-screaming-in-a-public-library,"A boy comes up to an Asian girl in class and says that his dad told him to stay away from Chinese people. After the victim tells him that she's Chinese, he backs away from her.","Minor-age offender, Offender is friend or acquaintance of target","Los Angeles, CA, USA",School,Harassment,"Verbal, gestural, or written harassment/threat",false,Chinese,Female,false
"May 21, 2021",ABC 7,Local news,https://web.archive.org/web/20210522035949/https://www.wxyz.com/news/plymouth-township-couple-fears-vandalism-tied-to-teenagers-hateful-language-about-asians,"An Asian man is mowing his grass when he hears a group of teens yell ""Hey, you [expletive] Chinese. Yeah, you over there!"" When he looks at them, they say ""Yeah, you! Go back to China. [Expletive] Chinese."" A week later, someone throws a rock and breaks the front window of victim's home. Police think the two incidents are related.",Minor-age offender,"Plymouth Charter Twp, MI 48170, USA",Home or housing,"Harassment, Property-related","Vandalism, damage, disorder, or destruction of property, Verbal, gestural, or written harassment/threat",false,Chinese,Male,false
"May 21, 2021",New York Times,National news,https://web.archive.org/web/20210607054453/https://www.nytimes.com/2021/05/21/opinion/asian-american-women-doctors-racism-sexism.html,"A man walks up to an Asian psychiatrist and spits on her, telling her that she “brought the sickness.” He then proceeds to call her a ""Hindu"" along with profanities.",,"Boston, MA, USA",Hospital or clinic,"Assault, Harassment","Assault without weapon, Verbal, gestural, or written harassment/threat",false,Indian,Female,false
"May 20, 2021",NextShark,Blog,https://web.archive.org/web/20210520172349/https://nextshark.com/salt-lake-city-vandalizing-vehicles-anti-asian-graffiti/,An unknown individual vandalizes at least two vehicles with anti-Asian graffiti.,,"200 Pierpont Ave, Salt Lake City, UT 84101, USA",Public area,Property-related,Graffiti,false,Asian,Unknown,false
"May 20, 2021",Facebook,Social media,https://fb.watch/5Dv4GDaKTR/,"Three women assault an elderly Asian man while he is sitting in his car, and a bystander intervenes and fights off the perpetrators. ","Third party intervenes , Elderly target, No explicit bias","Los Angeles, CA, USA",Transportation,Assault,Assault without weapon,false,Asian,Male,false
"May 20, 2021",MSNBC,National news,https://web.archive.org/web/20210522055643/https://www.msnbc.com/deadline-white-house/watch/kurt-bardella-shares-an-anti-asian-attack-he-experienced-just-today-112657989825?cid=sm_npd_ms_tw_ma,"DCCC advisor and former House Oversight Committee spokesperson, Kurt Bardella, opens up about a vile attack he experienced where people in the next car yelled racial slurs at him.",,"Virginia, USA",Public area,Harassment,"Verbal, gestural, or written harassment/threat",false,Asian,Male,false
"May 19, 2021",New Haven Register,Local news,https://web.archive.org/web/20210708140932/https://www.nhregister.com/news/article/New-Haven-weekend-homicide-victim-was-aspiring-16188082.php,An unknown individual shoots and kills a 20-year-old Asian American woman. ,No explicit bias,"Sheffield Ave, New Haven, CT 06511, USA",Unknown,Assault,Assault with weapon,false,Asian,Female,false
"May 19, 2021",Seattle Police Department,Law enforcement,https://web.archive.org/web/20210519230713/https://spdblotter.seattle.gov/2021/05/19/police-arrest-man-suspected-of-stealing-purses-bags-from-more-than-a-dozen-asian-women/,Police arrest a man suspected of stealing purses and bags from more than 12 Asian women. ,No explicit bias,"Seattle, WA, USA","Public area, Transportation","Property-related, Assault","Robbery or theft, Assault without weapon",false,Asian,Female,false
"May 18, 2021",Yahoo News,National news,https://web.archive.org/web/20210524233315/https://news.yahoo.com/young-man-dies-protecting-girlfriend-171128499.html,Three people approach a vehicle and attempt to carjack the 19-year-old Asian owner at gunpoint; the victim is shot and killed while attempting to protect his girlfriend.,No explicit bias,"789 E Poplar Ave, San Mateo, CA 94401, USA",Transportation,"Assault, Property-related","Assault with weapon, Vandalism, damage, disorder, or destruction of property, Robbery or theft",false,Asian,Male,false
"May 18, 2021",Hopclear,Blog,https://web.archive.org/web/20210519174647/https://www.hopclear.com/monterey-pizza-and-asian-zap-in-san-francisco-vandalized-and-burglarized/,An unknown individual burglarizes and vandalizes an Asian restaurant. ,No explicit bias,"599 Monterey Blvd, San Francisco, CA 94127, USA",Business,Property-related,"Robbery or theft, Vandalism, damage, disorder, or destruction of property",false,Asian,Unknown,false
"May 18, 2021",ABC 7,Local news,https://web.archive.org/web/20210601080541/https://abc7ny.com/asian-man-repeatedly-punched-on-manhattan-sidewalk/10656728/,"An individual approaches a 48-year-old Asian man and punches him repeatedly; the perpetrator then yells ""Go back to China"" and bits the victim on his hand before leaving. ",,"W 43rd St & 11th Ave, New York, NY 10036, USA",Public area,"Assault, Harassment","Assault without weapon, Verbal, gestural, or written harassment/threat",false,Chinese,Male,false
"May 18, 2021",NBC Bay Area,Local news,https://web.archive.org/web/20210531163930/https://www.nbcbayarea.com/news/local/san-francisco/woman-attacked-robbed-while-on-bart-train/2548610/,A man approaches an Asian woman and demands she gives him her phone; the perpetrator then assaults the victim and robs her of her belongings. ,No explicit bias,"16th St Mission, Qa, 2000 Mission St, San Francisco, CA 94110, USA",Transportation,"Assault, Property-related","Assault without weapon, Robbery or theft",false,Asian,Female,false
"May 18, 2021",Yahoo News,National news,https://web.archive.org/web/20210519163315/https://news.yahoo.com/temporarily-closed-restaurant-mexico-receives-223806876.html,"A temporarily closed restaurant places a sign reading ""Blame China!"" on its front doors and receives backlash. ",No individual target,"1338 Picacho Hills Dr, Las Cruces, NM 88007, USA",Business,Harassment,Visual media or signage,true,Chinese,Unknown,false
"May 17, 2021",NextShark,Blog,https://web.archive.org/web/20210517205616/https://nextshark.com/neighbor-force-feeding-son-babysitting/,"A woman accuses her Asian neighbor of force-feeding her son ""ethnic food"" while babysitting him. ",Offender is friend or acquaintance of target,,Home or housing,Harassment,"Verbal, gestural, or written harassment/threat",false,Asian,Female,false
"May 17, 2021",Hopclear,Blog,https://web.archive.org/web/20210519181140/https://www.hopclear.com/san-francisco-chinatown-business-owner-allegedly-attacked-twice-by-same-suspect/,Teens attempt to shoplift and assault the Asian store owner after she attempts to stop them. The same teens return to the store later that day and spray the victim in the face with an unknown substance; a man attempts to intervene on behalf of the victim and is also assaulted. ,"No explicit bias, Third party intervenes , Minor-age offender","900 Grant Ave, San Francisco, CA 94108, USA",Business,"Assault, Property-related","Assault with weapon, Assault without weapon, Robbery or theft",false,Asian,Female,false
