source_published_date,source_name,source_type,source_url,incident_description,incident_tags,incident_location,incident_location_type,incident_type,incident_action_type,incident_covid_related,victim_group_targeted,victim_gender,source_unavailable
"Apr 2, 2021",New York Daily News,Local news,https://www.nydailynews.com/new-york/nyc-crime/ny-nyc-asian-hate-knife-threaten-subway-20210402-abugcpynondtzbarijw7mcctra-story.html,"A man threatens a 27-year-old Asian woman with a knife while on a train and tells her to ""go back to China."" ",,"Myrtle - Wyckoff Avs, Brooklyn, NY 11237, USA",Transportation,Harassment,"Verbal, gestural, or written harassment/threat",false,Chinese,Female,false
"Apr 2, 2021",USA Today,National news,https://web.archive.org/web/20210406183651/https://www.usatoday.com/story/entertainment/celebrities/2021/04/02/teen-wolf-arden-cho-reveals-details-recent-anti-asian-attack/4850534001/,"A man yells ""I'm going to motherf_cking kill you ch_nk and your f_cking dog"" at Arden Cho, an Asian American actress, while she is walking her dog. ",Public figure,,Public area,Harassment,"Verbal, gestural, or written harassment/threat",false,Asian,Female,false
"Apr 2, 2021",The Charlotte Observer,Local news,https://web.archive.org/web/20210505201454/https://www.charlotteobserver.com/news/local/crime/article250389431.html,A man smashes items in an Asian-owned convenience store while yelling racial slurs. ,,"310 E Trade St, Charlotte, NC 28202, USA",Business,"Property-related, Harassment","Vandalism, damage, disorder, or destruction of property, Verbal, gestural, or written harassment/threat",false,Asian,"Female, Male",false
"Apr 2, 2021",Hartford Courant,Local news,https://web.archive.org/web/20210402174241/https://www.courant.com/breaking-news/hc-br-milford-man-yells-go-back-to-china-arrested-20210402-772u6fkzrjhbrohsakwvsg5stm-story.html,"A man harasses an Asian man for wearing a mask outdoors and tells him to ""go back to China."" ",Target wearing mask,"Hill St & W Town St, Milford, CT 06460, USA",Public area,Harassment,"Verbal, gestural, or written harassment/threat",false,Chinese,Male,false
"Apr 2, 2021",Sports Illustrated,National news,https://web.archive.org/web/20210402130219/https://www.si.com/sports-illustrated/2021/04/02,"A bicyclist cuts off an Asian jogger's path and shouts, “Go back to Wuhan, you ch_nk! It's because of you there's the virus!”","Target wearing mask, Offender not wearing mask","78 South St, New York, NY 10038, USA",Public area,Harassment,"Verbal, gestural, or written harassment/threat",true,Chinese,Female,false
"Apr 2, 2021",KRON 4,Local news,https://web.archive.org/web/20210403111442/https://www.kron4.com/news/bay-area/violent-robbery-on-san-francisco-street-caught-on-camera/,Two individuals push two elderly Asian women to the ground and rob them of their belongings.,"Elderly target, No explicit bias","Felton St & Goettingen St, San Francisco, CA 94134, USA",Public area,Assault,"Assault without weapon, Robbery or theft",false,Asian,Female,false
"Apr 2, 2021",Twitter,Social media,https://web.archive.org/web/20210402163842/https://twitter.com/SinoVoices/status/1378024018192691200,A man attempts to spit at a child and tells her father to “take it back to China.”,,"Salt Lake City, UT, USA",Unknown,"Assault, Harassment","Assault without weapon, Verbal, gestural, or written harassment/threat",false,Chinese,"Male, Female",false
"Apr 1, 2021",NextShark,Blog,https://web.archive.org/web/20210401185932/https://nextshark.com/louisiana-lafayette-store-anti-chinese-communist-mofo/,A store in Louisiana puts up a sign refusing “admittance to any Chinese Communist MoFo.” ,No individual target,"2472 W Congress St, Lafayette, LA 70506, USA",Business,Harassment,Visual media or signage,false,Chinese,Unknown,false
"Apr 1, 2021",NextShark,Blog,https://web.archive.org/web/20210402191411/https://nextshark.com/bakery-man-shoot-chinese-customers-san-francisco/,A man enters a bakery and threatens to get a gun and shoot Chinese customers; the man also stalks an Asian woman around the store. ,,"300 Golden Gate Ave, San Francisco, CA 94102, USA",Business,Harassment,"Verbal, gestural, or written harassment/threat",false,Chinese,"Female, Unknown",false
"Apr 1, 2021",Fox 10,Local news,https://web.archive.org/web/20210401032357/https://www.fox10phoenix.com/news/asian-american-man-reportedly-targeted-in-race-related-incident-during-phoenix-suns-game,A man throws a beer bottle at an Asian American man and his two kids and yells “[expletive] Asians” at a Phoenix Suns basketball game. ,,"201 E Jefferson St, Phoenix, AZ 85004, USA",Business,"Harassment, Assault","Verbal, gestural, or written harassment/threat, Assault with weapon",false,Asian,"Male, Unknown",false
"Apr 1, 2021",Asian Dawn,Blog,https://web.archive.org/web/20210403140108/https://www.asian-dawn.com/2021/04/02/62-year-old-man-kills-home-invader-with-suspects-own-gun/,"Two men attempt to rob a 62-year-old Asian man inside his home, and the victim disarms one of the perpetrators and shoots him. ","Elderly target, No explicit bias","43rd St, San Diego, CA 92105, USA",Home or housing,"Property-related, Assault","Robbery or theft, Assault with weapon",false,Asian,Male,false
"Apr 1, 2021",Asian Dawn,Blog,https://web.archive.org/web/20210410190519/https://www.asian-dawn.com/2021/04/02/asian-family-loses-entire-life-savings-during-home-invasion/,"Robbers tie up an Asian couple in front of their 7-year-old daughter, steal their entire life savings, and ransack their house.",No explicit bias,"Oakland, CA, USA",Home or housing,"Property-related, Assault","Assault without weapon, Robbery or theft",false,Asian,"Female, Male",false
"Apr 1, 2021",Business Insider,National news,https://web.archive.org/web/20210508095345/https://www.businessinsider.com/chick-fil-a-racism-accusation-from-asian-american-customer-2021-3,"An Asian American woman orders from Chick-fil-A and ""China"" is printed on the receipt in lieu of her name.

",,"Houston, TX, USA",Business,"Harassment, Shunning","Verbal, gestural, or written harassment/threat, Unequal service, treatment, or opportunities",false,Chinese,Female,false
"Apr 1, 2021",Facebook,Social media,https://www.facebook.com/groups/142455397210001/permalink/350699463052259/,"A woman harasses two Asian American sisters, saying that they have the coronavirus and telling them to ""go back to your country."" The woman also grabs one of the Asian woman's arms. ",,"Colorado, USA",Business,"Harassment, Assault","Verbal, gestural, or written harassment/threat, Assault without weapon",true,Asian,Female,false
"Apr 1, 2021",CBS SF BayArea,Local news,https://web.archive.org/web/20210403181607/https://sanfrancisco.cbslocal.com/2021/04/01/asian-american-attacks-vandal-tries-to-start-fire-at-oakland-asian-bakery-possible-hate-crime/,"A man attempts to start a fire at an Asian bakery, and one of the owners is able to extinguish the fire before it catches. ",No explicit bias,"2800 International Blvd, Oakland, CA 94601, USA",Public area,Property-related,"Vandalism, damage, disorder, or destruction of property",false,Asian,Male,false
"Apr 1, 2021",Hollywood Reporter,National news,https://web.archive.org/web/20210402205957/https://www.hollywoodreporter.com/news/dash-lily-star-midori-francis-tweets-she-was-spat-on-in-racist-attack,A car slows down and an individual spits at an Asian actress. ,No explicit bias,"Los Feliz Blvd & Fern Dell Dr, Los Angeles, CA 90027, USA",Public area,Assault,Coughing or spitting,false,Asian,Female,false
"Apr 1, 2021",Kitsap Daily News,Local news,https://www.kitsapdailynews.com/news/possible-anti-asian-hate-crime-being-investigated-in-port-orchard/,An unknown suspect vandalizes an Asian individual's car early in the morning. ,,"2100 Caleb Pl SE, Port Orchard, WA 98366, USA",Public area,Property-related,Graffiti,false,Asian,Unknown,false
"Apr 1, 2021",106.1 KMEL,Local news,https://kmel.iheart.com/featured/the-sana-g-morning-show/content/2021-04-01-stopasianhate-racist-altercation-caught-on-bart/?Pname=local_social&Sc=editorial&Keyid=socialflow,"A man calls an Asian man a ""Chinese n_gger"" and hits him multiple times.",,"San Francisco Bay Area, CA, USA",Transportation,"Assault, Harassment","Assault without weapon, Verbal, gestural, or written harassment/threat",false,Chinese,Male,false
"Mar 31, 2021",NextShark,Blog,https://web.archive.org/web/20210331224024/https://nextshark.com/oakland-asian-seniors-find-their-cars-burned/,A pair of Asian neighbors wake up to find their cars on fire. ,"No explicit bias, Elderly target","Oakland, CA, USA",Public area,Property-related,"Vandalism, damage, disorder, or destruction of property",false,Asian,Male,false
"Mar 31, 2021",New York Post,Local news,https://web.archive.org/web/20210404210906/https://nypost.com/2021/03/31/man-hurls-anti-asian-slurs-spits-on-woman-on-nyc-subway/,"A man calls an Asian woman an ""Asian slut"" along with other insults before spitting on her and throwing her phone onto the tracks after slapping it out of her hand. The Asian woman's children are present during the incident. ",,"Times Square, New York, NY 10036, USA",Transportation,"Assault, Harassment, Property-related","Assault without weapon, Vandalism, damage, disorder, or destruction of property, Verbal, gestural, or written harassment/threat",true,Asian,Female,false
"Mar 31, 2021",New York Post,Local news,https://web.archive.org/web/20210404210906/https://nypost.com/2021/03/31/man-hurls-anti-asian-slurs-spits-on-woman-on-nyc-subway/,A man comes up behind a 29-year-old Asian woman and lights her backpack on fire. ,No explicit bias,"W 34th St & 6th Ave, New York, NY 10001, USA",Transportation,"Assault, Property-related","Assault with weapon, Vandalism, damage, disorder, or destruction of property",false,Asian,Female,false
"Mar 31, 2021",ABC 4,Local news,https://web.archive.org/web/20210401192047/https://www.abc4.com/news/police-investigating-hateful-letters-sent-to-asian-americans-in-utah/,A letter is sent to an Asian-owned business in Utah stating that Asians need to go back to wherever they came from or more Asians may be killed. ,,"Taylorsville, UT, USA",Business,Harassment,"Verbal, gestural, or written harassment/threat",true,Asian,Unknown,false
"Mar 31, 2021",Raw Story,Blog,https://web.archive.org/web/20210331190739/https://www.rawstory.com/racist-meltdown-2651297652/,"A man confronts an Asian worker outside a massage business in a shopping mall while yelling about how the ""Chinese"" are responsible for the coronavirus and the business should not be open.",,,Business,Harassment,"Verbal, gestural, or written harassment/threat",true,Chinese,Male,false
"Mar 31, 2021",Facebook,Social media,https://fb.watch/4DovleJhRd/,A Korean business in San Bernadino is robbed. ,Target wearing mask,"San Bernardino, CA, USA",Business,Property-related,Robbery or theft,false,Asian,Unknown,false
"Mar 31, 2021",Q13 FOX,Local news,https://web.archive.org/web/20210403002531/https://www.q13fox.com/news/tacoma-police-investigate-hate-crime-after-video-shows-attack-on-asian-man,A man runs up to an Asian man and punches him. ,No explicit bias,"S Verde St, Tacoma, WA 98409, USA",Public area,Assault,Assault without weapon,false,Asian,Male,false
"Mar 31, 2021",Twitter,Social media,https://web.archive.org/web/20210417205850/https://twitter.com/DionLimTV/status/1377456125616918531,"A thief sneaks up on a 72-year-old Asian man from behind and hit him on the head, causing him fall to the ground and briefly lose consciousness. The perpetrator then grabs the victim's camera from him and escapes.","Elderly target, No explicit bias","Washington St & Drumm St, San Francisco, CA 94111, USA",Public area,Assault,"Assault without weapon, Robbery or theft",false,Asian,Male,false
"Mar 30, 2021",NextShark,Blog,https://web.archive.org/web/20210406220937/https://nextshark.com/new-york-city-elderly-asian-woman-punched-kicked/,"A man punches and repeatedly kicks the head of a 65-year-old Asian woman and also says ""f_ck you, you don't belong here.""","Elderly target, Unhoused offender","360 W 43rd St, New York, NY 10036, USA",Public area,"Assault, Harassment","Assault without weapon, Verbal, gestural, or written harassment/threat",false,Asian,Female,false
"Mar 30, 2021",NextShark,Blog,https://web.archive.org/web/20210330201217/https://nextshark.com/ushi-taro-sf-ramen-burglary-for-third-time/,A group of thieves break into and steal items and money from an Asian-owned ramen restaurant. This is the third time this same restaurant has been broken into by burglars in over a year. ,"No explicit bias, No individual target, Restaurant","1382 9th Ave, San Francisco, CA 94122, USA",Business,Property-related,"Vandalism, damage, disorder, or destruction of property, Robbery or theft",false,Asian,Male,false
"Mar 30, 2021",Hopclear,Blog,https://web.archive.org/web/20210331021907/https://www.hopclear.com/japanese-american-man-punched-in-face-in-washington-d-c/,An individual punches a 30-year-old Japanese American man in the face while he is walking in an unprovoked attack.,No explicit bias,"Cleveland Park, Washington, DC, USA",Public area,Assault,Assault without weapon,false,Asian,Male,false
"Mar 30, 2021",Hopclear,Blog,https://web.archive.org/web/20210331060039/https://www.hopclear.com/indonesian-teens-attacked-at-septa-station/,Four teenage girls harass and slap two teenage Indonesian American girls at a train station. ,Minor-age offender,"Southeastern Pennsylvania Transit Authority:Ticket service, 7913 Pocono St, Philadelphia, PA 19118, USA",Transportation,"Harassment, Assault","Assault without weapon, Verbal, gestural, or written harassment/threat",false,Asian,Female,false
"Mar 30, 2021",Raw Story,Blog,https://web.archive.org/web/20210330185826/https://www.rawstory.com/anti-asian-new-york-city/,A man approaches an Asian man and his girlfriend and threatens to slash him while spewing racist insults at a Home Depot. ,,"Brooklyn, NY, USA",Business,Harassment,"Verbal, gestural, or written harassment/threat",false,Asian,Male,false
"Mar 30, 2021",San Francisco Chronicle,Local news,https://web.archive.org/web/20210402000226/https://www.sfchronicle.com/crime/article/Asian-American-woman-robbed-in-broad-daylight-16064839.php,A man breaks a car widow and robs a 58-year-old Asian woman while she is sitting in a car.,"No explicit bias, Elderly target","Japantown, San Francisco, CA 94115, USA",Transportation,Property-related,"Robbery or theft, Vandalism, damage, disorder, or destruction of property",false,Asian,Female,false
"Mar 30, 2021",Twitter,Social media,https://web.archive.org/web/20210330230350/https://twitter.com/nowthisnews/status/1377033647602216962,An individual spits on an Asian healthcare provider working in the COVID ICU that serves New York City.,No explicit bias,"New York, NY, USA",Unknown,Assault,Assault without weapon,false,Asian,Female,false
"Mar 29, 2021",NextShark,Blog,https://web.archive.org/web/20210330063753/https://nextshark.com/palm-desert-restaurant-racist-customers/,Three customers at an Asian restaurant yell racial slurs and mock the English of an Asian restaurant owner after she asks them to leave. ,Restaurant,"72785 California 111 B4 B4, Palm Desert, CA 92260, USA",Business,Harassment,"Verbal, gestural, or written harassment/threat",false,Asian,Female,false
"Mar 29, 2021",NextShark,Blog,https://web.archive.org/web/20210329212808/https://nextshark.com/new-york-train-asian-woman-confronts-racist-man/,"A man says coronavirus is fake and yells ""ching chang chong"" and other slurs at Asian train passengers.",,"E Houston St & 2nd Ave, New York, NY 10002, USA",Transportation,Harassment,"Verbal, gestural, or written harassment/threat",true,Asian,Female,false
"Mar 29, 2021",Hopclear,Blog,https://web.archive.org/web/20210415071831/https://www.hopclear.com/asian-woman-struck-in-manhattan-subway-station/,"A man hits a 37-year-old Asian woman in the face with his hand while she is walking and says ""go back to your country... ch_nk"" before fleeing. ",,"E 51st St & Lexington Ave, New York, NY 10022, USA",Public area,"Assault, Harassment","Verbal, gestural, or written harassment/threat, Assault without weapon",false,Asian,Female,false
"Mar 28, 2021",Asian Dawn,Blog,https://web.archive.org/web/20210330024910/https://www.asian-dawn.com/2021/03/29/seattle-blm-supporter-arrested-charged-over-two-anti-asian-attacks/,A man yells racial slurs at Asian people and chases an Asian woman.,,"2050 S Columbian Way, Seattle, WA 98108, USA",Public area,Harassment,"Verbal, gestural, or written harassment/threat",false,Asian,"Female, Unknown",false
"Mar 27, 2021",AsAmNews,Blog,https://web.archive.org/web/20210327204147/https://asamnews.com/2021/03/27/the-letter-was-sent-from-the-new-york-city-government/,A New York City housing inspector uses a racial slur to refer to three Vietnamese tenants in an official letter sent from the city to the residents. ,,"East Side, New York, NY, USA",Home or housing,Harassment,"Verbal, gestural, or written harassment/threat",false,Asian,"Male, Unknown",false
"Mar 27, 2021",Hopclear,Blog,https://web.archive.org/web/20210328082723/https://www.hopclear.com/suspect-who-assaulted-philly-asian-store-worker-arrested/,"An Asian store employee chases down a woman who steals from her store, and the woman pulls the Asian woman's hair and punches her. The woman is arrested shortly after the incident.",No explicit bias,"7th St & Wolf St, Philadelphia, PA 19148, USA",Public area,"Property-related, Assault","Robbery or theft, Assault without weapon",false,Asian,Female,false
"Mar 27, 2021",New York Post,Local news,https://web.archive.org/web/20210329191005/https://nypost.com/2021/03/27/asian-woman-harassed-in-latest-nyc-bias-crime/,"A man harasses a 65-year-old Asian woman, saying ""you stupid Chinese blue hair. You stupid Chinese b_tch.""","Elderly target, Offender not wearing mask","W 40th St & 9th Ave, New York, NY 10018, USA",Public area,Harassment,"Verbal, gestural, or written harassment/threat",false,Chinese,Female,false
"Mar 27, 2021",NBC 5,Local news,https://web.archive.org/web/20210328042308/https://www.nbcchicago.com/news/local/police-apprehend-2-juveniles-after-racist-graffiti-discovered-at-mokena-park/2472795/,"Racist graffiti is found at a community park targeting Asian, Black and LGBTQ communities. Police apprehend two juveniles connected with the incident. ","Minor-age offender, No individual target","21431 Coneflower Dr, Mokena, IL 60448, USA",Public area,Property-related,Graffiti,false,Asian,Unknown,false
"Mar 27, 2021",The Seattle Times,Local news,https://web.archive.org/web/20210329163757/https://www.seattletimes.com/seattle-news/crime/prosecutors-charge-man-with-hate-crime-accusing-him-of-targeting-asian-women-in-seattle/,"A man cuts off two Asian women driving and yells ""Asian"" at them; the victims pull into a parking space and the perpetrator gets out of his car and throws an item at them before they drive away. ",,"4700 Beacon Ave S, Seattle, WA 98108, USA",Transportation,"Harassment, Assault","Assault with weapon, Verbal, gestural, or written harassment/threat",false,Asian,Female,false
"Mar 26, 2021",Hopclear,Blog,https://web.archive.org/web/20210409194454/https://www.hopclear.com/multiple-asian-businesses-receive-identical-racist-letter/,"An Asian-owned nail salon receives a racist letter targeting Asian Americans demanding they ""go back to their country."" Two other Asian-owned businesses receive an identical letter. ",,"10278 Indiana Ave # C, Riverside, CA 92503, USA",Business,Harassment,"Verbal, gestural, or written harassment/threat",false,Asian,"Female, Unknown",false
"Mar 26, 2021",Asian Dawn,Blog,https://web.archive.org/web/20210329003121/https://www.asian-dawn.com/2021/03/26/girls-13-and-15-charged-with-felony-murder-for-carjacking-ubereats-driver/,Two teenage girls assault a 66-year-old Asian man with a taser and attempt to carjack him; the victim is killed by a crash that occurs due to the attempted carjacking.,"No explicit bias, Elderly target, Minor-age offender","Van St SE & N St SE, Washington, DC 20003, USA",Public area,"Assault, Property-related","Assault with weapon, Robbery or theft",false,Asian,Male,false
"Mar 26, 2021",FOX 5,Local news,https://web.archive.org/web/20210326153524/https://www.fox5dc.com/news/asian-teen-spat-at-harassed-with-racial-slurs-outside-a-fairfax-county-middle-school-officials-say,Four juveniles racially harass and spit on an Asian teen while he is attempting to use a recreational field. ,Minor-age offender,"2000 Westmoreland St, Falls Church, VA 22043, USA",School,"Harassment, Assault","Coughing or spitting, Verbal, gestural, or written harassment/threat",false,Asian,Male,false
"Mar 26, 2021",Chicago Tribune,Local news,https://web.archive.org/web/20210417113825/https://www.chicagotribune.com/news/breaking/ct-uptown-chicago-attack-vietnamese-asian-20210326-tljxtrlgwzeydjxyjwb4skwuja-story.html,A man punches a 60-year-old Asian man from behind.,"No explicit bias, Elderly target","W Ainslie St, Chicago, IL, USA",Public area,Assault,Assault without weapon,false,Asian,Male,false
"Mar 26, 2021",CBS Sacramento,Local news,https://web.archive.org/web/20210327002153/https://sacramento.cbslocal.com/2021/03/26/woodland-asian-woman-verbal-assault-hateful-threats/,"A man follows an Asian woman and yells anti-Asian language, threatening to find ""the Chinese and kill them all.""",,"215 California St, Woodland, CA 95695, USA",Public area,Harassment,"Verbal, gestural, or written harassment/threat",false,Chinese,Female,false
"Mar 26, 2021",KOMO News,Blog,https://web.archive.org/web/20210401062734/https://komonews.com/news/local/hate-crime-charges-filed-against-man-for-alleged-violent-anti-asian-behavior,"A man threatens an Asian American woman and her two children while they are stopped in their car at a red light. The perpetrator yells ""f_ck you, you Asian b_tch. F_ck you!""",,"Martin Luther King Jr Way S & S Graham St, Seattle, WA 98118, USA",Transportation,Harassment,"Verbal, gestural, or written harassment/threat",false,Asian,Female,false
"Mar 25, 2021",Asian Dawn,Blog,https://web.archive.org/web/20210327185043/https://www.asian-dawn.com/2021/03/26/19-year-old-shot-in-the-head-for-being-asian/,Three men exit a car and shoot a 19-year-old Asian woman in the face; the victim is currently in a hospital. ,No explicit bias,"San Francisco, CA, USA",Unknown,Assault,Assault with weapon,false,Asian,Female,false
"Mar 25, 2021",New York Post,Local news,https://web.archive.org/web/20210328075447/https://nypost.com/2021/03/25/asian-man-punched-in-unprovoked-nyc-attack-cops/,A stranger punches a 38-year-old Asian man in an unprovoked attack. ,No explicit bias,"W 33rd St & 8th Ave, New York, NY 10001, USA",Public area,Assault,Assault without weapon,false,Asian,Male,false
"Mar 25, 2021",New York Post,Local news,https://web.archive.org/web/20210427224913/https://nypost.com/2021/03/25/city-council-candidate-susan-lee-pushed-down-subway-stairs-in-attack/,A woman shoves an Asian American city council candidate down a subway staircase. ,"Unhoused offender, No explicit bias, Public figure","World Trade Center, New York, NY 10007, USA",Transportation,Assault,Assault without weapon,false,Asian,Female,false
"Mar 25, 2021",NBC Bay Area,Local news,https://web.archive.org/web/20210329205110/https://www.nbcbayarea.com/news/local/sf-woman-wants-to-see-changes-after-recent-anti-asian-attack-on-muni-bus/2502890/,"A group of teenagers harasses, spits on, hits, and throws eggs at a 58-year-old Asian woman on a bus. ","Elderly target, Third party intervenes ","Japantown, San Francisco, CA 94115, USA",Transportation,"Assault, Harassment","Assault with weapon, Assault without weapon, Verbal, gestural, or written harassment/threat",false,Asian,Female,false
"Mar 25, 2021",Facebook,Social media,https://fb.watch/4zstI28WhK/,A woman punches an Asian woman and pulls her hair. ,No explicit bias,"South Philadelphia, Philadelphia, PA, USA",Public area,Assault,Assault without weapon,false,Asian,Female,false
"Mar 24, 2021",CBS Los Angeles,Local news,https://web.archive.org/web/20210325233143/https://losangeles.cbslocal.com/2021/03/24/asian-american-racist-letter/,"An Asian family receives a racist anti-Asian letter, saying ""go back to your country"", after one of their family members passes away.",,"Seal Beach, CA, USA",Unknown,Harassment,"Verbal, gestural, or written harassment/threat",false,Asian,Female,false
"Mar 24, 2021",NBC New York,Local news,https://www.nbcnewyork.com/news/local/good-samaritan-and-bus-driver-help-elderly-asian-couple-attacked-in-brooklyn/2961191/?fbclid=IwAR1lIAlgx2XJZ65268Bdr-d6LPn9J7A-8KmuYTmExt2x-DqcZK8HJUwhtyY,A man attacks two elderly Asians outside a supermarket; two bystanders intervene and law enforcement arrests the perpetrator. ,"No explicit bias, Elderly target, Third party intervenes ","25th Ave & 86th St, Brooklyn, NY 11214, USA",Public area,Assault,Unknown,false,Asian,Unknown,false
"Mar 24, 2021",Asian Dawn,Blog,https://www.asian-dawn.com/2021/03/24/store-owner-racially-insulted-and-attacked/?fbclid=IwAR0V-xGP-KG5GzZDnM6CUtOasHoH224_mV8yh4q8GcnhSNAbG5XBOsl-m0k,"A group of women punches an Asian beauty store owner, knocks over her store's displays, and harasses her saying ""Asian people shouldn’t be in the Black market."" ",,"Harris County, TX, USA",Business,"Assault, Harassment, Property-related","Assault without weapon, Vandalism, damage, disorder, or destruction of property, Verbal, gestural, or written harassment/threat",false,Asian,Female,false
