source_published_date,source_name,source_type,source_url,incident_description,incident_tags,incident_location,incident_location_type,incident_type,incident_action_type,incident_covid_related,victim_group_targeted,victim_gender,source_unavailable
"May 15, 2022",The Daily Star,Foreign news,https://www.thedailystar.net/nrb/news/bangladeshi-student-dies-after-pushed-subway-track-new-york-3023156,Individuals push a Bangladeshi student to her death on a subway track. ,No explicit bias,"New York, NY, USA",Transportation,Assault,Assault without weapon,false,Asian,Female,false
"May 15, 2022",AsAmNews,Blog,https://asamnews.com/2022/05/15/sikhs-in-richmond-hills-say-the-men-are-being-attacked-because-they-were-turbans/,An individual attacks and robs an elderly Sikh man. ,No explicit bias,"Richmond Hill, Queens, NY, USA",Public area,"Assault, Property-related","Assault with weapon, Assault without weapon, Robbery or theft",false,Asian,Male,false
"May 15, 2022",NBC Los Angeles,Local news,https://www.nbclosangeles.com/news/local/multiple-people-hit-in-shooting-at-laguna-woods-church-suspected-shooter-in-custody/2893860/,An individual open fires on Taiwanese church goers; five are wounded and one dies. ,Elderly target,"Laguna Woods, CA, USA",Place of worship,Assault,Assault with weapon,false,Asian,"Male, Female",false
"May 13, 2022",Instagram,Social media,https://www.instagram.com/tv/Cdg0hUmgKeT/?igshid=YmMyMTA2M2Y%3D,An individual assaults and robs an Asian woman in a parking lot. ,No explicit bias,"1499 Washington Ave, San Leandro, CA 94577, USA",Transportation,"Assault, Property-related","Assault with weapon, Robbery or theft",false,Asian,Female,false
"May 11, 2022",NBC DFW,Local news,https://www.nbcdfw.com/news/local/developing-dallas-police-respond-to-shooting-call-at-hair-salon/2965495/?_osource=SocialFlowTwt_DFWBrand,An individual shoots three women at a Korean owned salon. ,No explicit bias,"2216 Royal Ln #111, Dallas, TX 75229, USA",Business,Assault,Assault with weapon,false,Asian,Female,false
"May 10, 2022",New York Post,Local news,https://nypost.com/2022/05/10/nyc-chinese-food-deliveryman-punched-shot-at-and-robbed/,Individuals assault and rob a Chinese food delivery man. ,No explicit bias,"Lefferts Ave & Lamont Ct, Brooklyn, NY 11225, USA",Public area,"Assault, Property-related","Robbery or theft, Assault with weapon, Assault without weapon",false,Asian,Male,false
"May 9, 2022",PIX 11,Local news,https://pix11.com/news/local-news/queens/sikh-man-speaks-out-after-violent-queens-attack-assault-is-latest-in-string-of-similar-crimes/,An individual assaults and attempts to rob an elderly Sikh man.  ,"No explicit bias, Elderly target","Queens, NY, USA",Public area,"Assault, Property-related","Assault with weapon, Assault without weapon, Robbery or theft",false,Asian,Male,false
"May 7, 2022",AsAmNews,Blog,https://asamnews.com/2022/05/07/street-art-meant-to-beautify-chinatown-instead-vandalized-by-taggers/,An individual defaces an Asian mural in Chinatown. ,No individual target,"Chinatown, San Francisco, CA, USA",Public area,Property-related,Graffiti,false,Asian,Unknown,false
"May 5, 2022",ABC 7,Local news,"https://abc7news.com/oakland-carjacking-youth-crime-spree-gang-violence-asian-hate/11821793/#:~:text=EXCLUSIVE%3A%20Siblings%20call%20for%20accountability,the%20Teng%20siblings%20in%20Oakland.&text=Minors%20as%20young%20as%2011%20are%20suspected,attacks%20in%20the%20East%20Bay",Two juveniles assault and carjack Asian siblings. ,"No explicit bias, Minor-age offender","Oakland, CA, USA",Transportation,"Assault, Property-related","Assault with weapon, Assault without weapon, Robbery or theft",false,Asian,"Female, Male",false
"May 3, 2022",The Oregonian,Local news,https://www.oregonlive.com/crime/2022/05/asian-oregonians-face-rising-level-of-race-based-hate-crimes-harassment-surveys-indicate.html,A number of Asian businesses are vandalized or broke into over the weekend. ,Restaurant,"NW Cornell Rd, Portland, OR, USA",Business,Property-related,"Vandalism, damage, disorder, or destruction of property",false,Asian,Unknown,false
"May 2, 2022",CBS News,National news,https://www.cbsnews.com/newyork/news/asian-american-woman-attacked-possible-hate-crime-chelsea/,An individual punches a 68-year-old Asian woman in an unprovoked attack. ,Elderly target,"9th Ave & W 19th St, New York, NY 10011, USA",Public area,Assault,Assault without weapon,false,Asian,Female,false
"May 2, 2022",New York Post,Local news,https://nypost.com/2022/05/02/killing-of-chinese-food-delivery-man-in-queens-may-have-stemmed-from-duck-sauce-dispute/?utm_source=NYPFacebook&utm_medium=SocialFlow&utm_campaign=SocialFlow&sr_share=facebook&fbclid=IwAR06AGAYeLIa_FBz7RQsOE6FSRSOq43LEPGb9Yc0kkXx3ed3imD6hd1oKx0,An individual shoots a Chinese delivery driver while he is driving his scooter. ,No explicit bias,"108th St & 67th Dr, Queens, NY 11375, USA",Transportation,Assault,Assault with weapon,false,Asian,Male,false
"Apr 28, 2022",ABC 7,Local news,https://abc7news.com/sf-burglary-asian-america-aapi-crime/11801703/?fbclid=IwAR27MNSPm-5zeGQLjWPp2XgExWALMEYRuevNWMnZzkVQZGfSJ0ygijbXJDQ,Crime spree targets 27 Asian households in San Francisco.,,"San Francisco, CA, USA",Home or housing,Property-related,"Robbery or theft, Vandalism, damage, disorder, or destruction of property",false,Asian,"Female, Male",false
"Apr 26, 2022",Reddit,Social media,https://www.reddit.com/r/AmItheAsshole/comments/uck3l6/aita_for_telling_my_co_worker_that_i_eat_dogs/,A man asks his Asian colleague if she eats dogs. ,,,Business,Harassment,"Verbal, gestural, or written harassment/threat",false,Asian,Female,false
"Apr 26, 2022",AsAmNews,Blog,https://asamnews.com/2022/04/26/anti-asian-hate-bias-crime-bar-fight/,A man racially harasses and assaults an Asian woman with a pool cue. ,,"1570 Ferry Rd, Grand Island, NY 14072, USA",Business,"Assault, Harassment","Assault with weapon, Verbal, gestural, or written harassment/threat",false,Asian,Female,false
"Apr 22, 2022",NBC Bay Area,Local news,https://www.nbcbayarea.com/news/local/woman-attacked-in-broad-daylight-in-san-franciscos-north-beach-neighborhood-police/2871943/?_osource=SocialFlowTwt_BAYBrand,An individual assaults an Asian woman in an unprovoked attack.,No explicit bias,"North Beach, San Francisco, CA, USA",Public area,"Harassment, Assault","Verbal, gestural, or written harassment/threat, Assault with weapon, Assault without weapon",false,Asian,Female,false
"Apr 21, 2022",NBC Boston,Local news,https://www.nbcboston.com/news/local/70-year-old-asian-american-woman-describes-unprovoked-attack-in-chinatown/2699315/,A man punches a 70-year-old Asian woman in an unprovoked attack. ,"No explicit bias, Elderly target","Chinatown, Boston, MA, USA",Public area,Assault,Assault without weapon,false,Asian,Female,false
"Apr 14, 2022",NBC News,Local news,https://www.nbcnews.com/news/asian-america/man-20-charged-hate-crimes-attack-2-sikh-men-nyc-rcna24367?cid=sm_npd_nn_fb_aa&fbclid=IwAR1XGTuCsMZLkFt5E1gq8mjuipg6ISSn9H-hQsM2eJTM0Oz8ow-vE96gtYk&_branch_match_id=1032161088527285016&utm_source=socialflow&_branch_referrer=H4sIAAAAAAAAA8soKSkottLXz0tKzkstL9ZLLCjQy8nMy9Y3LyhMDyrJ9EkpSLJPzkyxLc6NzytIic%2FLi09Lik9MVEtLSs4BCnuWOwYZRriHlDoX%2B0b5ZLuVmLoaphda5GaVZhakm3kGB%2BdZeuhmBBb7GqV6hfga%2BFdZ5JfrlrlamqWXRGYDAO4WphN9AAAA,An individual assaults two Sikh men in an unprovoked attack. ,,"95th Ave & Lefferts Blvd, Queens, NY 11419, USA",Public area,Assault,"Assault with weapon, Assault without weapon",false,Asian,Male,false
"Apr 14, 2022",NextShark,Blog,https://nextshark.com/bcd-tofu-house-irvine-racist-rants-apple-pay/,An angry customer racially harasses a tofu house employee.  ,,"2700 Alton Pkwy #135, Irvine, CA 92606, USA",Business,Harassment,"Verbal, gestural, or written harassment/threat",false,Asian,Unknown,false
"Apr 13, 2022",Chicago Journal,Local news,https://www.chicagojournal.com/61-year-old-chef-found-robbed-and-beaten-into-coma-family-finds-him-through-facebook-as-john-doe-at-stroger/,A 61-year-old Asian man is found beaten and robbed. ,Elderly target,"W 25th Pl & S Stewart Ave, Chicago, IL 60616, USA",Public area,"Assault, Property-related","Robbery or theft, Unknown",false,Asian,Male,false
"Apr 13, 2022",AsAmNews,Blog,https://asamnews.com/2022/04/23/chinatown-businessman-says-bringing-awareness-to-these-crimes-remains-important/,Three Asian women are attacked in separate incidents in San Francisco. ,,"San Francisco, CA, USA",Public area,"Assault, Harassment","Verbal, gestural, or written harassment/threat, Assault with weapon, Assault without weapon",false,Asian,Female,false
"Apr 10, 2022",Asian Dawn,Blog,https://www.asian-dawn.com/2022/04/10/reporter-harassed-random-asian-man-thinking-it-was-andy-ngo/,"A reporter harasses an Asian man at a bar, thinking he is Andy Ngo. ",,"New Orleans, LA, USA",Business,Harassment,"Verbal, gestural, or written harassment/threat",false,Asian,Male,false
"Apr 7, 2022",Asian Dawn,Blog,https://www.asian-dawn.com/2022/04/07/70-year-old-asian-woman-stabbed-in-the-back-in-brooklyn/,An individual stabs a 70-year-old Asian woman in the back in an unprovoked attack. ,"No explicit bias, Elderly target","Sunset Park, Brooklyn, NY, USA",Public area,Assault,Assault with weapon,false,Asian,Female,false
"Apr 7, 2022",Yahoo News,National news,https://news.yahoo.com/man-charged-hate-crime-yelling-164420666.html,"A man berates an Asian man for wearing a mask and tells him to ""go back to China."" ",,"Hill St & W Town St, Milford, CT 06460, USA",Public area,Harassment,"Verbal, gestural, or written harassment/threat",false,Chinese,Male,false
"Apr 5, 2022",Asian Dawn,Blog,https://www.asian-dawn.com/2022/04/05/another-asian-female-teen-student-attacked-in-philly-train/,Three individuals assault and rob a 17-year-old Asian woman. ,,"Broad St, Philadelphia, PA, USA",Transportation,"Assault, Property-related","Assault without weapon, Robbery or theft",false,Asian,Female,false
"Apr 3, 2022",CBS New York,Local news,https://www.cbsnews.com/newyork/news/advocates-call-attack-on-sikh-man-in-queens-a-hate-crime/,An individual assaults a 70-year-old Sikh man in an unprovoked attack. ,Elderly target,"95th Ave & Lefferts Blvd, Queens, NY 11419, USA",Public area,Assault,Assault without weapon,false,Asian,Male,false
"Apr 1, 2022",The Villager,Local news,https://www.amny.com/news/nypd-cuff-knife-wielding-anti-asian-bigot-in-harlem-subway/,An individual threatens and harasses a 43-year-old Asian woman on a train. ,,"137th St, Queens, NY 11354, USA",Public area,"Harassment, Assault","Assault with weapon, Verbal, gestural, or written harassment/threat",false,Asian,Female,false
"Mar 31, 2022",AsAmNews,Blog,https://asamnews.com/2022/03/31/violence-attack-on-elderly-asian-man-midtown-new-york/,"An individual assaults, harasses, and robs a 73-year-old Asian man. ",Elderly target,"W 40th St & 8th Ave, New York, NY 10018, USA",Public area,"Assault, Harassment, Property-related","Assault without weapon, Verbal, gestural, or written harassment/threat, Robbery or theft",false,Asian,Male,false
"Mar 31, 2022",AsAmNews,Blog,https://asamnews.com/2022/03/31/gambing-addiction-wreckless-driving-intentional-hit-and-run-oakland/,"Individuals appear to intentionally hit a 66-year-old Asian man with their car, killing him. ",No explicit bias,"Oakland, CA, USA",Public area,Assault,Assault with weapon,false,Asian,Male,false
"Mar 30, 2022",San Francisco Police ,Law enforcement,https://www.sanfranciscopolice.org/news/san-francisco-police-arrest-armed-robbery-crew-22-045,Four individuals attempt to carjack a 37-year-old Asian man. ,No explicit bias,"1000 Mississippi St, San Francisco, CA 94107, USA",Transportation,"Assault, Property-related","Robbery or theft, Assault with weapon",false,Asian,Male,false
"Mar 29, 2022",AsAmNews,Blog,https://asamnews.com/2022/03/29/two-men-stabbed-while-trying-to-help-elderly-asian-woman-being-robbed/,Individuals rob and stab a 61-year-old Korean woman; two bystanders intervene and are also stabbed. ,"Elderly target, Third party intervenes , No explicit bias","Baxter Ave, Queens, NY 11373, USA",Public area,"Assault, Property-related","Robbery or theft, Assault with weapon",false,Asian,Female,false
"Mar 29, 2022",Daily News,Local news,https://www.nydailynews.com/new-york/nyc-crime/ny-mcdonalds-panhandler-customer-attack-video-20220329-6j4zvdrpwja47kl2ihclh743ye-story.html,An individual assaults a 53-year-old Filipino man. ,"No explicit bias, Elderly target","429 7th Ave, New York, NY 10001, USA",Business,Assault,Assault without weapon,false,Asian,Male,false
"Mar 26, 2022",Asian Dawn,Blog,https://www.asian-dawn.com/2022/03/26/asian-man-pistol-whipped-and-robbed-of-his-watch-in-san-francisco/,Three individuals assault and rob an Asian man. ,,"1 Warriors Way, San Francisco, CA 94158, USA",Public area,"Harassment, Assault, Property-related","Assault with weapon, Verbal, gestural, or written harassment/threat, Robbery or theft",false,Asian,Male,false
"Mar 25, 2022",Asian Dawn,Blog,https://www.asian-dawn.com/2022/03/26/multiple-asian-restaurants-targeted-by-black-teens-in-los-angeles/,A group of teens are suspected for targeting multiple Asian-owned restaurants in the Los Angeles area. ,Restaurant,"6122 Sunset Blvd, Los Angeles, CA 90028, USA",Business,Property-related,"Robbery or theft, Vandalism, damage, disorder, or destruction of property",false,Asian,Male,false
"Mar 24, 2022",Asian Dawn,Blog,https://www.asian-dawn.com/2022/03/24/carjacking-home-invasions-in-san-francisco/,Individuals commit two home invasions within the span of two hours; the homeowners are Asian. ,Elderly target,"1300 24th Ave, San Francisco, CA 94122, USA",Home or housing,"Assault, Property-related","Vandalism, damage, disorder, or destruction of property, Robbery or theft, Assault with weapon",false,Asian,Male,false
"Mar 22, 2022",CBS Chicago,Local news,https://www.cbsnews.com/chicago/news/beverly-store-owner-closing-after-robbery/,An individual robs an Asian-owned store. ,No individual target,"W 107th Pl & S Hale Ave, Chicago, IL 60643, USA",Business,Property-related,Robbery or theft,false,Asian,Female,false
"Mar 18, 2022",Asian Dawn,Blog,https://www.asian-dawn.com/2022/03/18/102-year-old-korean-man-assaulted-in-koreatown/,A man assaults and robs a 102-year-old Asian man; a bystander witnesses the incident and scares off the perpetrator.  ,"No explicit bias, Elderly target, Third party intervenes ","W 7th St & S Spring St, Los Angeles, CA 90014, USA",Public area,"Assault, Property-related","Robbery or theft, Assault without weapon",false,Asian,Male,false
"Mar 17, 2022",Huffpost,Blog,https://www.huffpost.com/entry/the-boys-star-karen-fukuhara-calls-to-stop-asian-hate-after-being-physically-attacked_n_623364bde4b009ab92f55539,A man assaults an Asian actor outside a cafe in an unprovoked attack.,Public figure,,Public area,Assault,Assault without weapon,false,Asian,Female,false
"Mar 15, 2022",ABC 10,Local news,https://www.abc10.com/article/news/crime/south-sacramento-attack/103-7c4a9784-deb3-464e-9e41-1a36fceafdc3,Two individuals slam into the back of an Asian woman's car before robbing her. ,No explicit bias,"Stockton Blvd, Sacramento, CA, USA",Transportation,"Assault, Property-related","Assault with weapon, Robbery or theft",false,Asian,Female,false
"Mar 14, 2022",NBC New York,Local news,https://www.nbcnewyork.com/news/local/ny-woman-punched-125-times-foot-stomped-in-brutal-hate-crime-beating-police/3598054/,A man racially harasses and punches a 67-year-old 125 times. ,"Third party intervenes , Elderly target","Bronx, NY, USA",Home or housing,"Assault, Harassment","Assault without weapon, Verbal, gestural, or written harassment/threat",false,Asian,Female,false
"Mar 14, 2022",Daily News,Local news,https://www.nydailynews.com/new-york/nyc-crime/ny-immigration-lawyer-fatally-stabbed-client-queens-office-20220314-c7e7c5it3jhvro4e5t5aigxjh4-story.html,A woman fatally stabs a 66-year-old Asian immigration lawyer after he decides not to take her case. ,"Elderly target, No explicit bias","39th Ave & 138th St, Queens, NY 11354, USA",Business,Assault,Assault with weapon,false,Asian,Male,false
"Mar 13, 2022",CNN Philippines,Foreign news,https://www.cnnphilippines.com/news/2022/3/13/elderly-filipinas-attacked-new-york-.html,Two elderly Filipina women are assaulted on the same day in separate attacks. ,"No explicit bias, Elderly target","179th St & Hillside Avenue, Queens, NY 11432, USA",Transportation,Assault,Assault without weapon,false,Asian,Female,false
"Mar 12, 2022",AsAmNews,Blog,https://asamnews.com/2022/03/12/man-on-nyc-subway-tells-asian-woman-i-think-all-asians-should-die/,"A man tells an Asian woman that he thinks ""all Asians should die"" while riding on the subway. ",,"625 8th Ave, New York, NY 10018, USA",Transportation,Harassment,"Verbal, gestural, or written harassment/threat",false,Chinese,Female,false
"Mar 9, 2022",AsAmNews,Blog,https://asamnews.com/2022/03/09/gofundme-started-for-asian-woman-paralyzed-after-being-stabbed/,"A man stabs a 65-year-old Asian woman, leaving her paralyzed. ","No explicit bias, Elderly target","900 E Broadway, Long Beach, CA 90802, USA",Business,Assault,Assault with weapon,false,Asian,Female,false
"Mar 9, 2022",CBS Philly,Local news,https://philadelphia.cbslocal.com/2022/03/09/police-search-burglars-target-asian-owned-business-philadelphia-montgomery-county/,A group of burglars target Asian-owned businesses in Philadelphia. ,No individual target,"Philadelphia, PA, USA",Business,Property-related,"Vandalism, damage, disorder, or destruction of property, Robbery or theft",false,Asian,Unknown,false
"Mar 9, 2022",Twitter,Social media,https://twitter.com/CeFaanKim/status/1501764572012855299?ref_src=twsrc%5Etfw%7Ctwcamp%5Etweetembed%7Ctwterm%5E1501764572012855299%7Ctwgr%5E%7Ctwcon%5Es1_&ref_url=https%3A%2F%2Ffeedly.com%2Fi%2Fmy,An individual assaults an Asian man with a hammer. ,No explicit bias,"6th Ave, New York, NY, USA",Transportation,Assault,Assault with weapon,false,Asian,Male,false
"Mar 7, 2022",New York Daily News,Local news,https://www.nydailynews.com/new-york/nyc-crime/ny-subway-razor-attack-arrest-slashing-20220307-pkxl66cfrnaizbjgnyutvkvnrq-story.html,A man slashes a 41-year-old Asian subway rider in the face. ,No explicit bias,"Delancey St · Essex St, New York, NY 10002, USA",Transportation,Assault,Assault with weapon,false,Asian,Male,false
"Mar 7, 2022",The Village Sun,Local news,https://thevillagesun.com/asian-female-deli-worker-in-east-village-assaulted-by-shoplifter-after-mask-dispute,A man punches an Asian woman in the face after she tells him to put on a face mask. ,Offender not wearing mask,"94 Avenue B, New York, NY 10009, USA",Business,Assault,Assault without weapon,false,Asian,Female,false
"Mar 5, 2022",New York Post,Local news,https://nypost.com/2022/03/05/nyc-residents-alleged-reign-of-terror-ends-in-vicious-anti-asian-assault-arrest/?utm_campaign=SocialFlow&sr_share=facebook&utm_medium=SocialFlow&utm_source=NYPFacebook&fbclid=IwAR2V7fLiy7ViC85spPhO7ZgNx3vxpTxqH63bxGV1y0kG44Tjw_Ki18IgXE4,A man racially abuses and assaults his 39-year-old Asian neighbor. The perpetrator has a history of racially abusing other Asian residents that live in the building. ,,"E 126th St, New York, NY 10035, USA",Home or housing,"Assault, Harassment","Assault without weapon, Verbal, gestural, or written harassment/threat",true,Chinese,Male,false
"Mar 4, 2022",NBC New York,Local news,https://www.nbcnewyork.com/news/local/crime-and-courts/nyu-students-ask-school-to-ramp-up-security-after-attack-spree/3584153/,Three Asian American NYU students are assaulted within the span of a month.,,"New York, NY 10012, USA",College or university,Assault,Assault without weapon,false,Asian,"Male, Unknown",false
"Mar 2, 2022",New York Times,National news,https://www.nytimes.com/2022/03/02/nyregion/asian-women-attacked-nypd.html,"A man assaults seven Asian women in the span of two hours, and is later charged with hate crimes. ",Elderly target,"E 30th St & Madison Ave, New York, NY 10016, USA",Public area,Assault,Assault without weapon,false,Asian,Female,false
"Mar 2, 2022",WUSA9,Local news,https://www.wusa9.com/article/news/crime/police-arrest-announcement-days-after-lyft-driver-abdul-rauf-khan-was-killed-price-georges-county/65-c2c5f321-5f25-4e9d-ab82-3223a3b34250,An individual fatally shoots a 71-year-old Asian man during a carjacking. ,"No explicit bias, Elderly target","3700 Dunlap St, Temple Hills, MD 20748, USA",Transportation,"Assault, Property-related","Assault with weapon, Robbery or theft",false,Asian,Male,false
"Feb 28, 2022",Las Vegas Sun,Local news,https://lasvegassun.com/news/2022/feb/28/sisolak-wife-threatened-at-las-vegas-restaurant/,Individuals racially harass Nevada Governor Steve Sisolak's Chinese wife. ,Public figure,"10082 W Flamingo Rd, Las Vegas, NV 89147, USA",Business,Harassment,"Verbal, gestural, or written harassment/threat",false,Chinese,Female,false
"Feb 28, 2022",Instagram,Social media,https://www.instagram.com/reel/CaiOClHFrvM/,A woman racially harasses an Asian family and blames them for spreading germs. ,,"Pleasantville, NJ, USA",Business,Harassment,"Verbal, gestural, or written harassment/threat",false,Asian,Unknown,false
"Feb 25, 2022",Deadline,Blog,https://deadline.com/2022/02/asian-american-dancer-attack-off-broadway-public-theater-the-chinese-lady-1234960116/,An individual assaults an Asian American dancer while he is on his way to a performance. ,No explicit bias,"Lower East Side, New York, NY, USA",Public area,Assault,Assault without weapon,false,Asian,Male,false
"Feb 23, 2022",PIX11,Local news,https://pix11.com/news/local-news/manhattan/white-supremacists-zoom-bomb-ny-lawmakers-event-with-slurs-pornography/,Individuals zoombomb a NY Asian American assemblywoman during a virtual event. ,Zoombombing,,"Online, Unknown",Harassment,"Verbal, gestural, or written harassment/threat, Visual media or signage",false,Asian,Female,false
"Feb 22, 2022",Twin Cities Pioneer Press,Local news,https://www.twincities.com/2022/02/22/15-year-old-arrested-in-murder-of-businesswoman-34-found-shot-in-vehicle-in-st-paul/,A teen fatally shoots a 34-year-old Asian woman in an unprovoked attack.,No explicit bias,"1000 Payne Ave, St Paul, MN 55130, USA",Public area,Assault,Assault with weapon,false,Asian,Female,false
"Feb 21, 2022",Daily Bruin,Local news,https://dailybruin.com/2022/02/21/ucla-community-members-voice-concerns-over-white-supremacist-rally-flyer,A white supremacy rally flyer is sent to the Asian American Studies Center at UCLA. ,No individual target,"Campbell Hall, 335 Portola Plaza, Los Angeles, CA 90095, USA",College or university,Harassment,"Verbal, gestural, or written harassment/threat",false,Asian,Unknown,false
"Feb 21, 2022",ABC 7,Local news,https://abc7news.com/oakland-little-saigon-asian-store-owner-assaulted-robbery-gunpoint-9th-international/11584911/,Individuals rob an Asian couple at gunpoint. ,No explicit bias,"9th Ave & International Blvd, Oakland, CA 94606, USA",Public area,"Assault, Property-related","Assault with weapon, Robbery or theft",false,Asian,"Female, Male",false
"Feb 18, 2022",AsAmNews,Blog,https://asamnews.com/2022/02/18/juvenile-crime-youth-suspects-violent-carjacking-philadelphia/,Three juveniles fatally beat a 70-year-old Asian man during a carjacking.,"Elderly target, No explicit bias","Philadelphia, PA, USA",Transportation,"Assault, Property-related","Robbery or theft, Assault without weapon",false,Asian,Male,false
"Feb 18, 2022",Instagram,Social media,https://www.instagram.com/tv/CaIC1nmjQrI/?utm_medium=share_sheet,"A man threatens two Asian men and calls them a ""chink.""",,"Brooklyn, NY, USA",Transportation,Harassment,"Verbal, gestural, or written harassment/threat",false,Asian,Male,false
"Feb 16, 2022",ABC 7,Local news,https://abc7ny.com/chinatown-murder-memorial-vandalized-christina-lee-in/11572322/,An unknown individual vandalizes a memorial for a murdered Asian woman. ,No individual target,"Chrystie St, New York, NY 10002, USA",Public area,Property-related,"Vandalism, damage, disorder, or destruction of property",false,Asian,Unknown,false
"Feb 15, 2022",The Harvard Crimson,Local news,https://www.thecrimson.com/article/2022/2/15/uc-president-racist-flyers/,Paper signs containing racial slurs are posted on the door of the Asian undergraduate council president at Harvard University. ,,"58 Plympton St, Cambridge, MA 02138, USA",College or university,Harassment,"Verbal, gestural, or written harassment/threat, Visual media or signage",false,Asian,Male,false
"Feb 15, 2022",NextShark,Blog,https://nextshark.com/georgetown-law-professor-chinese-student-mr-chinaman/,"A Georgetown Law professor addresses an Asian student as ""Mr. Chinaman"". ",,"600 New Jersey Ave NW, Washington, DC 20001, USA",College or university,"Shunning, Harassment","Unequal service, treatment, or opportunities, Verbal, gestural, or written harassment/threat",false,Chinese,Male,false
"Feb 14, 2022",NBC Bay Area,Local news,https://www.nbcbayarea.com/news/local/peninsula/hate-crime-charges-filed-against-man-who-spit-on-asian-couple-in-daly-city/2812481/,A man racially harasses and spits on an Asian couple at a mall. ,,"Westlake Center, Daly City, CA 94015, USA",Business,"Assault, Harassment","Coughing or spitting, Verbal, gestural, or written harassment/threat",false,Asian,Unknown,false
"Feb 13, 2022",New York Post,Local news,https://nypost.com/2022/02/13/woman-stabbed-to-death-inside-nyc-apartment-cops-say/,A homeless man follows a 25-year-old Asian woman into her apartment and fatally stabs her. ,"No explicit bias, Unhoused offender","111 Chrystie St, New York, NY 10002, USA",Home or housing,Assault,Assault with weapon,false,Asian,Female,false
"Feb 9, 2022",NextShark,Blog,https://nextshark.com/chinese-woman-struck-with-baseball-bat/,A man assaults a Chinese woman with a baseball bat while she in walking home from work.,No explicit bias,"200 Cedar St, Seattle, WA 98121, USA",Public area,Assault,Assault with weapon,false,Asian,Female,false
